1, 1069home0.jpg, 834.30, laborum velit exercitation, Occaecat ea magna nulla do et. Ipsum ex cillum nostrud aliquip aute sint eiusmod., Barcelona, Veniam aliquip sint eu voluptate. Non nostrud quis sunt ullamco laborum consequat deserunt pariatur. Sint et in officia consectetur irure est sint sint. Adipisicing et irure Lorem pariatur sunt exercitation elit aliqua. Commodo irure amet deserunt cillum minim enim incididunt., Sat Sep 07 2013 21:20:42 GMT-0700 (PDT), 498, 723, 1069, 6
2, 1012home0.jpg, 370.06, labore ipsum esse, Dolor irure Lorem esse irure aute nisi. Ex aliquip in in incididunt., London, Aliqua mollit culpa. Fugiat enim enim nostrud pariatur occaecat quis sunt. Labore eiusmod nulla amet. Consectetur esse velit ut quis sint consequat excepteur enim deserunt., Mon Oct 03 2016 19:00:42 GMT-0700 (PDT), 712, 18, 1012, 6
3, 1043home0.jpg, 223.57, ea do id, Sint excepteur esse nisi sit commodo sint reprehenderit proident esse. Id quis ex ut excepteur ex laboris., Barcelona, Exercitation laboris in consequat sint in incididunt. Est deserunt incididunt reprehenderit duis adipisicing ea amet. Aliquip pariatur nulla esse anim anim ullamco anim. Ad sit laborum anim ut officia elit cupidatat. Velit irure enim enim elit deserunt et cupidatat consectetur et., Fri Apr 27 2012 18:47:29 GMT-0700 (PDT), 144, 216, 1043, 6
4, 1097home0.jpg, 746.91, exercitation laboris do, Veniam culpa et id ullamco deserunt cupidatat aliquip. Id cillum reprehenderit proident et ea do., Santorini, Consectetur commodo. Aute commodo proident nostrud magna nostrud. Esse deserunt amet anim quis aliqua adipisicing. Exercitation non nostrud dolore quis qui exercitation. Esse est et aliqua excepteur laboris qui esse. Veniam fugiat cupidatat sunt dolor tempor velit., Fri Jan 06 2017 11:22:36 GMT-0800 (PST), 129, 834, 1097, 6
5, 1020home0.jpg, 954.58, sit non enim, Cillum eu occaecat laborum est consequat. Irure ipsum commodo anim labore quis aliquip., London, Ea eu adipisicing cupidatat qui ad ullamco labore. Dolore consectetur. Ut anim enim velit qui sit qui. Nostrud adipisicing. Aliqua Lorem non irure voluptate ex cupidatat exercitation duis magna. Sit veniam officia. Anim eu magna ullamco eu exercitation aliqua velit id., Sat Mar 23 2013 08:43:36 GMT-0700 (PDT), 714, 313, 1020, 6
6, 1073home0.jpg, 134.16, exercitation in incididunt, Eu elit nostrud et eiusmod consectetur duis dolor cupidatat. Anim veniam Lorem reprehenderit proident nulla ex., Panama, Dolore adipisicing aliqua commodo proident do cillum. Cillum magna qui id ipsum. Cillum commodo aliqua mollit sunt quis Lorem dolore ipsum. Ipsum incididunt nostrud dolore esse ea., Fri Aug 01 2014 21:16:29 GMT-0700 (PDT), 417, 113, 1073, 6
7, 1037home0.jpg, 935.99, incididunt nisi culpa, Ipsum aute irure ipsum sit irure proident Lorem proident. Officia commodo culpa occaecat deserunt quis elit incididunt sit., Madrid, Duis proident esse quis. Esse labore eiusmod id fugiat sunt culpa et consequat. Laboris ex aute sunt voluptate eiusmod qui excepteur non. Lorem consectetur aliqua minim officia sunt ex non aute nulla. Ea nulla culpa., Fri Jan 15 2016 06:55:01 GMT-0800 (PST), 898, 289, 1037, 6
8, 1052home0.jpg, 413.27, pariatur anim mollit, Quis duis excepteur Lorem cupidatat veniam. Culpa exercitation in ex tempor., Madrid, Commodo ex tempor do magna minim ut elit adipisicing veniam. Adipisicing amet dolore reprehenderit nostrud. Non eu elit aliquip duis do ipsum sunt. Deserunt officia officia sint in dolore laboris est. Commodo ut voluptate laborum eiusmod ipsum culpa consectetur esse. Culpa eu. Officia sunt veniam quis amet consectetur dolor., Sun Aug 03 2014 20:56:55 GMT-0700 (PDT), 571, 184, 1052, 6
9, 1121home0.jpg, 925.24, sunt consectetur laborum, Commodo do tempor magna id velit eiusmod deserunt pariatur commodo. Deserunt elit qui deserunt ad sunt dolor velit nostrud., Ibiza, Esse nisi. Eiusmod culpa in sint laborum. Cupidatat culpa commodo., Sun Oct 16 2016 08:00:52 GMT-0700 (PDT), 370, 734, 1121, 6
10, 1095home0.jpg, 972.92, labore fugiat enim, Cupidatat adipisicing Lorem magna veniam. Adipisicing fugiat dolor laboris magna magna irure enim., Paris, Laboris nostrud. Magna dolor est eiusmod pariatur consequat. Enim est incididunt non eiusmod aliqua labore sunt Lorem. Sunt sint fugiat do aute ea. Eu ad in Lorem anim elit proident et sint aliquip. Non fugiat reprehenderit ipsum veniam Lorem ea nulla anim., Fri Mar 27 2015 02:20:37 GMT-0700 (PDT), 847, 558, 1095, 6
11, 1075home0.jpg, 722.35, incididunt occaecat Lorem, Consequat velit id minim sint ex labore. Irure aute eiusmod mollit ullamco., Dublin, Anim ex nostrud ipsum cupidatat mollit eiusmod consectetur consequat. Ut nisi laboris ad mollit laboris sit quis consectetur tempor. Amet dolor amet eiusmod ad minim. Aute enim eiusmod adipisicing. Eu commodo quis laborum anim., Mon Oct 17 2016 00:59:37 GMT-0700 (PDT), 182, 598, 1075, 6
12, 1080home0.jpg, 66.23, magna nisi id, Consequat ullamco Lorem enim commodo Lorem nulla in. Ad sunt eiusmod aliquip aliqua aute., London, Sint sit culpa nisi. Ullamco labore adipisicing voluptate proident dolore ut. Ea eiusmod ex reprehenderit labore laborum irure eiusmod pariatur in. Ex incididunt officia aliquip minim adipisicing veniam nisi qui. Ex non in aliquip labore deserunt. Ut et nostrud dolor quis consequat consequat esse reprehenderit., Wed Aug 19 2015 11:22:14 GMT-0700 (PDT), 440, 38, 1080, 6
13, 1011home0.jpg, 973.92, sint sint elit, Est ullamco non occaecat consequat Lorem fugiat veniam Lorem officia. Cupidatat sint laboris nulla amet nisi., Berlin, Proident esse et occaecat commodo occaecat. Labore officia eiusmod esse eu ea. Eiusmod ex culpa. Duis cupidatat Lorem exercitation deserunt labore dolor ullamco ad tempor. Incididunt anim ullamco. Anim cupidatat voluptate id exercitation irure cillum consequat cupidatat enim. Dolor sint nisi aliquip irure aute est laboris adipisicing., Thu Mar 17 2016 01:22:55 GMT-0700 (PDT), 322, 746, 1011, 6
14, 1113home0.jpg, 584.42, adipisicing consequat aliqua, Exercitation enim anim aliqua excepteur sunt est anim. Reprehenderit ex occaecat do sit duis minim velit fugiat consequat., London, Eu deserunt. Est elit esse ut incididunt sunt laborum incididunt labore fugiat. Ea cillum aliqua sit ex. Reprehenderit deserunt Lorem ullamco. Nisi esse ad ad nostrud do mollit id. Do labore laboris aliquip voluptate cupidatat deserunt proident. Sint nostrud culpa cupidatat ex nulla., Sat Jun 20 2015 22:44:31 GMT-0700 (PDT), 150, 678, 1113, 6
15, 1112home0.jpg, 114.38, enim deserunt esse, Proident irure laboris esse dolor. Esse tempor tempor pariatur enim do sint duis aliqua dolore., Panama, Esse sint. Ea aute incididunt in velit minim. Voluptate Lorem aute pariatur fugiat officia sunt consectetur., Mon Oct 05 2015 15:42:54 GMT-0700 (PDT), 366, 895, 1112, 6
16, 1095home0.jpg, 180.48, dolore cillum occaecat, Mollit veniam voluptate ex ut. Incididunt voluptate anim dolore proident ea., Paris, Sit in Lorem. Quis Lorem magna amet ad ex. Dolor qui velit. Nisi do ipsum aute et Lorem aute dolor mollit. Aliquip minim exercitation sint culpa amet mollit. Sit id aliqua. Veniam ut consectetur nostrud sunt eiusmod., Sat Aug 01 2015 07:37:54 GMT-0700 (PDT), 561, 267, 1095, 6
17, 1105home0.jpg, 335.83, eu nostrud culpa, Ipsum irure elit ut minim sunt sunt deserunt laboris pariatur. Reprehenderit fugiat quis aliquip in aute consectetur., Madrid, Dolore eiusmod nostrud excepteur sint reprehenderit culpa duis aliqua. Minim excepteur veniam Lorem. In aute laboris et consectetur voluptate aliqua magna Lorem., Wed Aug 30 2017 19:30:09 GMT-0700 (PDT), 593, 401, 1105, 6
18, 1035home0.jpg, 237.09, deserunt ea consequat, Reprehenderit commodo magna aliqua enim eu mollit. Ullamco ex duis consequat sint aliquip qui mollit culpa., Santorini, Fugiat incididunt reprehenderit non fugiat ea id non. Ut veniam anim dolore dolore do. Exercitation sit cillum irure occaecat. Nulla nisi enim incididunt ea irure., Sun Apr 21 2013 17:06:40 GMT-0700 (PDT), 113, 913, 1035, 6
19, 1046home0.jpg, 204.83, veniam excepteur laborum, Qui aliquip anim exercitation fugiat ipsum dolor pariatur. Culpa deserunt reprehenderit sunt irure proident sint., Paris, Sint do duis Lorem mollit. Voluptate aliquip elit aute. Occaecat eu incididunt irure in laborum. Dolore do., Sat Apr 07 2012 01:03:23 GMT-0700 (PDT), 673, 500, 1046, 6
20, 1029home0.jpg, 356.44, sit veniam fugiat, Laboris esse officia exercitation laborum aliquip Lorem. Voluptate consectetur labore adipisicing anim veniam., Mykonos, Excepteur est ipsum quis ea nostrud et. Id ex sunt consectetur anim reprehenderit non proident amet. Nisi velit commodo dolore aliqua officia. Mollit mollit ea nostrud laborum eiusmod. Non exercitation. Fugiat reprehenderit anim ipsum amet in veniam magna ut dolor., Sun Nov 03 2013 16:35:53 GMT-0800 (PST), 631, 722, 1029, 6
21, 1107home0.jpg, 512.15, dolor aliqua commodo, Eu eiusmod laborum enim deserunt cillum est cupidatat Lorem consectetur. Amet dolor aliqua commodo cillum voluptate fugiat elit., Mykonos, In pariatur exercitation in eu. Amet irure. Anim sint anim elit. Id cillum minim duis id fugiat consectetur eiusmod ex., Sun Sep 07 2014 19:47:42 GMT-0700 (PDT), 929, 472, 1107, 6
22, 1011home0.jpg, 91.92, qui nostrud exercitation, Ad minim veniam eu aliqua eu laborum tempor dolor. Ipsum irure sit deserunt incididunt ipsum aute Lorem., London, Non fugiat ullamco est enim aliquip. Aliquip commodo. Voluptate ipsum ex ex eu sint. Nostrud do veniam nostrud. Ut cillum pariatur fugiat ad officia adipisicing commodo mollit. Adipisicing commodo laboris enim Lorem sint culpa veniam et., Fri Mar 11 2016 14:26:12 GMT-0800 (PST), 750, 40, 1011, 6
23, 1012home0.jpg, 426.65, duis mollit officia, Sit qui dolor eu magna aute magna. Magna aliqua irure sunt sunt laboris., Santorini, Consectetur cupidatat. Enim ex dolore eu elit ad ad dolore et. Deserunt excepteur sint pariatur consectetur non. Ullamco fugiat eu. Eu qui aute reprehenderit voluptate ea proident eu cupidatat exercitation. Consequat amet velit eu cupidatat qui sit. Consectetur aliqua quis quis adipisicing cillum duis., Wed Oct 21 2015 01:49:50 GMT-0700 (PDT), 967, 578, 1012, 6
24, 1086home0.jpg, 263.51, nisi nisi nisi, Lorem voluptate pariatur aute Lorem sit. Consectetur esse laborum mollit sint., Dublin, Eiusmod deserunt sint. Labore laboris in ullamco est pariatur id laboris enim. Laborum magna ea mollit qui nisi cupidatat laboris aliqua., Fri Apr 15 2016 13:34:40 GMT-0700 (PDT), 595, 743, 1086, 6
25, 1036home0.jpg, 165.16, pariatur veniam excepteur, Incididunt Lorem excepteur sit laborum. Laboris pariatur commodo consequat eiusmod occaecat proident non culpa proident., London, Est tempor occaecat tempor mollit Lorem culpa amet magna sunt. Dolore culpa duis do adipisicing cillum Lorem sit laborum. Est eu fugiat ex sunt. Enim duis est id sint magna anim. Elit non amet ullamco consectetur est dolor eu. Magna reprehenderit esse incididunt voluptate velit adipisicing reprehenderit incididunt nulla. Pariatur sint ullamco tempor irure magna sit consectetur., Mon Mar 19 2018 17:50:18 GMT-0700 (PDT), 23, 354, 1036, 6
26, 1002home0.jpg, 352.00, consectetur sit est, In dolor enim do excepteur magna. Laborum ex amet excepteur ea duis., Ibiza, Nostrud quis adipisicing non. Eu esse quis anim commodo. Minim Lorem ullamco consequat reprehenderit id aliquip. Dolore velit ad ipsum id ad. Fugiat esse aliqua. Ullamco laboris ea incididunt., Sat Nov 10 2012 13:04:02 GMT-0800 (PST), 141, 618, 1002, 6
27, 1010home0.jpg, 512.48, minim eiusmod ad, Esse aliquip irure eiusmod laborum reprehenderit quis sunt adipisicing. Esse tempor exercitation officia dolore., London, Sint exercitation commodo veniam irure. Excepteur magna est eiusmod est incididunt. Duis ullamco nulla enim duis. Aliquip non nisi sunt laborum anim velit. Laborum fugiat enim., Thu Nov 13 2014 07:55:34 GMT-0800 (PST), 922, 117, 1010, 6
28, 1051home0.jpg, 880.46, labore commodo labore, Amet veniam cillum sunt ipsum Lorem. Proident quis sint in Lorem consectetur minim eiusmod tempor., Dublin, Dolor velit reprehenderit irure mollit occaecat. Officia irure consectetur officia aute sunt. Cupidatat enim ullamco nisi cupidatat laboris., Sun Jul 07 2013 15:39:28 GMT-0700 (PDT), 639, 143, 1051, 6
29, 1016home0.jpg, 359.08, velit ad non, Id anim dolor enim minim quis elit proident esse. Commodo esse fugiat consectetur tempor velit consequat voluptate., Paris, Pariatur cillum adipisicing fugiat. Minim consequat ut duis do sit aliquip esse. Esse laboris aliqua exercitation anim. Tempor exercitation fugiat do est et. Proident commodo ad commodo consectetur est deserunt qui id elit. Ad nisi voluptate elit aliqua tempor ad deserunt incididunt commodo. Commodo id aliquip ipsum consectetur eiusmod nulla cupidatat est., Sat Mar 24 2012 15:00:58 GMT-0700 (PDT), 522, 936, 1016, 6
30, 1059home0.jpg, 490.27, anim reprehenderit incididunt, Adipisicing reprehenderit qui nisi nostrud anim. Sunt Lorem exercitation esse ut., London, Aliqua aliquip elit cillum eiusmod in velit sint. Sunt minim cupidatat. Nisi velit ea sunt anim culpa., Tue Aug 12 2014 05:38:41 GMT-0700 (PDT), 91, 84, 1059, 6
31, 1119home0.jpg, 937.75, sunt labore amet, Velit reprehenderit fugiat minim non incididunt pariatur. Occaecat tempor do laboris in., Paris, Labore ullamco dolor non deserunt aute. Occaecat aute pariatur ex adipisicing sint minim magna ea adipisicing. Qui magna aliquip nulla. Proident aliqua ad commodo sit. Consectetur fugiat nulla proident. Est incididunt consequat veniam. Aliquip nulla Lorem ex amet dolor mollit id duis., Wed Dec 05 2012 06:47:10 GMT-0800 (PST), 105, 204, 1119, 6
32, 1115home0.jpg, 440.65, fugiat elit irure, Ex sunt tempor ad adipisicing officia. Tempor deserunt laborum reprehenderit fugiat amet eu quis., Berlin, Ea commodo. Excepteur labore consectetur voluptate nulla ullamco velit. Anim mollit id. Dolore culpa consequat in aliquip occaecat. Sunt esse reprehenderit ut. Sunt reprehenderit consequat est consequat deserunt laborum amet mollit esse. Aliqua ea Lorem mollit ad commodo dolor ex dolor ipsum., Thu May 29 2014 11:52:00 GMT-0700 (PDT), 475, 657, 1115, 6
33, 1039home0.jpg, 783.65, est fugiat deserunt, Commodo non ea et sit duis magna sunt Lorem. Et ad eiusmod quis incididunt magna ut occaecat est., Ibiza, Est sint dolore do officia nisi est duis. Ut cillum ea cillum ad qui mollit et velit qui. Officia eu nostrud aliquip cillum nisi ullamco anim id ea. Non duis non. Occaecat magna aliqua ex aute sint ex sit culpa. Nulla commodo non labore sit esse excepteur. Esse cillum fugiat aliquip cillum., Mon Feb 03 2014 23:15:41 GMT-0800 (PST), 539, 308, 1039, 6
34, 1075home0.jpg, 523.00, est cillum pariatur, Adipisicing est voluptate consequat officia ex proident. Aliquip laborum mollit amet sit labore officia., Venice, Pariatur labore. Tempor minim excepteur. Sunt ea nulla do. Ea eiusmod eiusmod amet. Id ut culpa laborum. Amet irure ad amet minim., Thu Oct 06 2016 16:36:21 GMT-0700 (PDT), 581, 107, 1075, 6
35, 1008home0.jpg, 266.43, velit duis tempor, Est laboris quis exercitation consequat est tempor voluptate ex. Dolor aliqua velit quis cupidatat eiusmod eu ipsum cupidatat., Madrid, Ad duis irure laboris laboris ad. Esse adipisicing cupidatat. Fugiat Lorem proident consequat. Mollit voluptate laboris magna cillum non ex cillum qui esse. Sint eu quis dolor., Tue Apr 23 2013 12:38:24 GMT-0700 (PDT), 872, 798, 1008, 6
36, 1076home0.jpg, 109.82, occaecat Lorem nisi, Veniam ex ad pariatur ullamco dolore consectetur. Eu nisi dolore occaecat qui nulla ad tempor., Panama, Incididunt cupidatat culpa qui mollit voluptate. Tempor laborum nulla dolore amet ea laboris dolor. Deserunt occaecat. Magna aute et qui aute eu cupidatat et culpa enim. Minim id cillum minim enim esse sint., Fri Sep 11 2015 04:50:16 GMT-0700 (PDT), 306, 630, 1076, 6
37, 1043home0.jpg, 565.18, nostrud sit aliquip, Fugiat officia ipsum nisi exercitation mollit. Sint exercitation velit laborum officia non ut minim., Madrid, Anim sit. Est sint aliquip amet. Velit Lorem qui., Sun Feb 12 2012 21:21:34 GMT-0800 (PST), 620, 711, 1043, 6
38, 1059home0.jpg, 162.71, ex cupidatat in, Enim officia cupidatat laborum velit laborum et commodo. Non magna duis nulla adipisicing do., Berlin, Adipisicing cupidatat occaecat. Non non nulla sunt do sint do anim aute esse. Sint et consequat quis voluptate quis et magna. Labore id veniam consectetur anim. Excepteur id laborum minim enim exercitation., Mon Mar 05 2018 11:58:34 GMT-0800 (PST), 309, 239, 1059, 6
39, 1033home0.jpg, 91.50, nisi excepteur nulla, Velit dolor magna anim reprehenderit voluptate dolor. Aliquip ut consequat mollit consectetur aliqua ullamco excepteur reprehenderit., London, Pariatur esse pariatur labore ea ut ad. Amet labore est. Laborum eiusmod anim occaecat. Qui aliquip officia non., Fri Aug 26 2016 17:17:09 GMT-0700 (PDT), 672, 412, 1033, 6
40, 1015home0.jpg, 675.08, consequat Lorem consectetur, Consequat eiusmod velit id qui officia. Sunt dolore excepteur incididunt deserunt laborum anim do non irure., Santorini, Proident magna ipsum tempor Lorem aute ea pariatur. Amet incididunt labore cupidatat laborum commodo mollit fugiat velit ex. In culpa., Sat Sep 08 2012 21:15:06 GMT-0700 (PDT), 615, 522, 1015, 6
41, 1048home0.jpg, 543.54, tempor ullamco officia, Minim excepteur ipsum ullamco excepteur ipsum. Occaecat occaecat culpa nisi voluptate nisi in irure nulla amet., Berlin, Officia aliquip officia consequat ut nisi voluptate cillum incididunt. Incididunt excepteur aute ut incididunt dolor mollit mollit ex et. Consectetur pariatur elit consequat velit et. Ea dolore ipsum velit. Deserunt aliquip. Officia nisi adipisicing sit ex minim laborum., Thu Aug 28 2014 14:13:50 GMT-0700 (PDT), 477, 754, 1048, 6
42, 1007home0.jpg, 742.09, eiusmod magna esse, Anim proident elit eiusmod id pariatur. Mollit in anim irure culpa ea mollit elit cupidatat., Madrid, Qui id proident culpa. Veniam id magna. Pariatur aliqua sit officia anim consectetur sit exercitation. Nostrud sit ad ut. Occaecat ad laboris occaecat. Proident excepteur proident cupidatat culpa veniam consectetur. Culpa id ipsum laborum dolor irure nisi nostrud elit sint., Thu Jun 18 2015 07:14:38 GMT-0700 (PDT), 123, 884, 1007, 5
43, 1043home0.jpg, 31.96, non cillum aliqua, Duis Lorem sunt aliquip nostrud eiusmod eiusmod irure commodo. Excepteur mollit est culpa do adipisicing eu minim commodo., London, Qui est nisi deserunt ea et. Elit non commodo tempor amet consectetur sit proident. Fugiat laboris laborum labore. Sint minim quis ad culpa aute incididunt ipsum consectetur tempor. Ea sunt ea eu consectetur. Ea et amet exercitation., Sat Mar 28 2015 12:15:46 GMT-0700 (PDT), 752, 102, 1043, 6
44, 1049home0.jpg, 767.61, voluptate ipsum duis, Et eiusmod ipsum aliqua adipisicing cillum dolore incididunt ipsum adipisicing. Minim deserunt officia et enim fugiat sit velit., Panama, Voluptate ea in cupidatat ex duis. Velit Lorem sint tempor occaecat. Minim voluptate voluptate qui sint sunt. Ut sunt exercitation commodo eiusmod exercitation esse. Esse enim pariatur deserunt culpa fugiat dolor id consectetur ut. Non amet elit adipisicing enim do duis. Eiusmod quis sint veniam nulla sit exercitation laboris minim proident., Mon Dec 04 2017 18:28:27 GMT-0800 (PST), 495, 404, 1049, 6
45, 1072home0.jpg, 989.62, ullamco deserunt deserunt, Ex proident sint consectetur fugiat laboris nostrud ad mollit. Sint aliquip cillum magna eiusmod aute est., Berlin, Consectetur voluptate consequat anim. Consequat sint veniam do amet labore est. Do elit duis enim. Magna ut velit nostrud ut laborum proident. Elit fugiat ullamco. Adipisicing sit aliquip do tempor. Commodo velit ipsum., Mon Jul 07 2014 03:20:49 GMT-0700 (PDT), 146, 217, 1072, 6
46, 1055home0.jpg, 659.96, quis non esse, Dolore commodo aliqua elit occaecat aute adipisicing. Irure magna amet est dolor ut enim., Berlin, Duis incididunt laboris ut adipisicing culpa excepteur aliquip aliqua voluptate. Magna commodo officia sunt aliqua exercitation laborum. Dolor ex. Labore minim laboris non voluptate ut id labore in qui. Ut amet ex ut do., Tue Apr 19 2016 12:39:21 GMT-0700 (PDT), 125, 88, 1055, 6
47, 1087home0.jpg, 500.18, anim id laboris, Eiusmod in reprehenderit elit pariatur Lorem in do officia. Commodo laboris aute sint veniam., Barcelona, Est ex ad consequat. Lorem veniam amet. Aliqua laboris consectetur Lorem ad cillum laboris fugiat. Qui exercitation voluptate nisi nulla deserunt. Commodo esse consequat duis tempor consectetur minim et ut velit. Ad nulla proident deserunt minim proident qui sint. Ex adipisicing nisi esse deserunt., Mon May 01 2017 02:14:23 GMT-0700 (PDT), 687, 648, 1087, 6
48, 1025home0.jpg, 158.43, aute laborum minim, Ut cillum aute laborum deserunt. Nostrud magna esse exercitation aliqua officia eu laborum., Rome, Cillum velit sit ad id. Anim id voluptate ex nisi eiusmod aliqua nisi labore. Lorem do ea. Anim eiusmod velit Lorem ut., Fri Jun 15 2018 21:32:28 GMT-0700 (PDT), 377, 160, 1025, 6
49, 1105home0.jpg, 435.19, cupidatat voluptate voluptate, Duis excepteur eiusmod laborum sunt fugiat. Proident aliqua quis duis cillum quis., Mykonos, Sunt dolor quis mollit mollit proident. Veniam ad anim dolor ullamco. Reprehenderit duis do dolor. Exercitation laborum amet pariatur eiusmod nisi non. Labore aute dolor., Thu Dec 29 2016 21:06:46 GMT-0800 (PST), 422, 897, 1105, 6
50, 1074home0.jpg, 103.05, excepteur tempor et, Reprehenderit occaecat cupidatat consequat qui laboris consectetur occaecat ad. Duis culpa incididunt ullamco magna., Panama, Minim enim adipisicing sunt laborum. Ea amet ex. Consectetur aute eiusmod. Cillum anim., Tue Mar 03 2015 11:05:47 GMT-0800 (PST), 508, 974, 1074, 6
51, 1071home0.jpg, 553.52, anim laboris occaecat, Dolore deserunt adipisicing eu aliqua excepteur eiusmod. Tempor incididunt labore culpa officia ullamco magna mollit., Madrid, Quis voluptate deserunt nostrud. Veniam excepteur laboris aliqua quis reprehenderit cillum qui aliquip. Nisi reprehenderit pariatur., Tue Mar 24 2015 15:42:54 GMT-0700 (PDT), 365, 512, 1071, 6
52, 1103home0.jpg, 240.35, fugiat consectetur sunt, Mollit occaecat cillum deserunt elit irure aliquip duis adipisicing consectetur. In consequat eu occaecat enim anim., Santorini, Ullamco ex officia eiusmod. Cillum ut enim eiusmod eiusmod mollit nulla quis deserunt. Sunt id cillum amet aute nostrud reprehenderit aute. Consequat aliquip non pariatur esse labore. Amet commodo cupidatat sunt excepteur voluptate quis., Sat Oct 12 2013 21:14:34 GMT-0700 (PDT), 166, 100, 1103, 6
53, 1026home0.jpg, 405.10, aliqua sint incididunt, Eiusmod nostrud duis sit do deserunt ipsum proident dolore sit. Est do culpa aliqua in., Madrid, Non anim duis exercitation non eiusmod. Nisi amet cillum ad quis minim nulla ipsum. Commodo nostrud eiusmod elit id in id enim eiusmod eiusmod., Sat Oct 31 2015 21:45:17 GMT-0700 (PDT), 901, 52, 1026, 6
54, 1069home0.jpg, 476.35, in esse dolore, Eu mollit laboris eu cillum enim sint sit officia. Fugiat ut magna et aute eiusmod laborum., Dublin, Laboris culpa voluptate. Ullamco exercitation. Tempor ad laboris Lorem proident nulla anim., Fri Feb 15 2013 07:50:40 GMT-0800 (PST), 900, 419, 1069, 6
55, 1017home0.jpg, 529.45, enim occaecat aliqua, Consequat nulla esse ut culpa commodo. In enim qui in duis dolore quis ipsum ex., Ibiza, Consectetur nostrud excepteur in reprehenderit ea. Lorem est do nulla. Consequat voluptate anim. Dolor eu ad magna enim commodo. Laboris non aute aliqua est. Sit deserunt incididunt occaecat occaecat., Fri Aug 07 2015 09:59:03 GMT-0700 (PDT), 556, 146, 1017, 6
56, 1040home0.jpg, 311.63, irure excepteur enim, Laborum aliqua Lorem sunt ullamco. Minim velit irure laboris consequat tempor., Paris, Aliquip do ad. Lorem sint sit tempor duis et non sint et. Commodo est elit. Est non mollit deserunt consectetur enim id tempor tempor adipisicing. Fugiat duis adipisicing reprehenderit cupidatat consectetur velit ex et ad. Amet duis pariatur eiusmod., Tue Jul 07 2015 08:25:19 GMT-0700 (PDT), 100, 689, 1040, 6
57, 1018home0.jpg, 956.28, laboris incididunt qui, Qui consectetur id ipsum cillum veniam anim nostrud nulla nisi. Adipisicing aliqua et tempor aute in ad ullamco., Berlin, Consequat aute nostrud quis eu nisi ad eu mollit sunt. Voluptate velit et nostrud officia reprehenderit. Occaecat sit ex. Veniam consequat dolore. Id veniam reprehenderit sunt ex dolore adipisicing et., Fri Aug 09 2013 10:19:58 GMT-0700 (PDT), 381, 338, 1018, 6
58, 1077home0.jpg, 916.62, commodo ipsum culpa, Sit consectetur duis sint sit qui qui voluptate. Irure reprehenderit nulla ipsum dolore duis pariatur., Mykonos, Ea nulla est sint commodo aliquip pariatur est. Nisi fugiat magna nisi excepteur consequat. Enim ad nostrud enim occaecat Lorem. Aliqua adipisicing reprehenderit esse voluptate non. Qui ad sit nostrud occaecat irure laboris., Wed Sep 17 2014 16:41:57 GMT-0700 (PDT), 522, 338, 1077, 6
59, 1117home0.jpg, 173.02, eu qui culpa, In deserunt aliquip consectetur esse velit sint. Adipisicing duis est est cillum., London, Cillum enim et ullamco dolore et dolore nisi ex. Dolore esse tempor. Dolore commodo dolore pariatur ipsum consequat anim incididunt voluptate Lorem. Labore mollit commodo esse ad quis pariatur fugiat et exercitation. Esse quis aliqua adipisicing laboris., Fri Jun 06 2014 23:55:23 GMT-0700 (PDT), 88, 832, 1117, 6
60, 1104home0.jpg, 776.41, reprehenderit Lorem do, Est eiusmod pariatur eu do anim aliqua veniam. Officia qui et Lorem do ullamco duis., Rome, Esse ullamco non enim incididunt deserunt proident. Mollit ullamco proident sint. Qui nostrud eiusmod in cupidatat elit ipsum est. Culpa tempor enim reprehenderit exercitation. Officia pariatur laboris., Sun Nov 15 2015 19:28:50 GMT-0800 (PST), 78, 4, 1104, 6
