246, 1124home0.jpg, 662.77, mollit proident tempor, Amet laboris anim dolor dolor aliqua enim commodo aliquip. Ad irure magna minim tempor id magna consequat sit., Panama, Consectetur quis nisi nostrud elit laboris. Do commodo aute officia labore eiusmod amet aliqua. Deserunt occaecat consequat magna ut eu occaecat tempor occaecat. Exercitation est aute et laboris amet ad labore. Commodo amet aliquip irure elit amet proident. Ullamco qui aliquip reprehenderit sunt anim., Wed Jan 30 2013 23:21:08 GMT-0800 (PST), 376, 101, 1124, 6
247, 1010home0.jpg, 106.72, commodo fugiat eu, Velit laboris ut laborum esse. Sit aliqua officia tempor quis laborum qui., Dublin, Cillum enim cillum deserunt enim est magna ex exercitation. Nulla veniam cillum labore aliqua deserunt cillum nostrud eiusmod. Irure adipisicing duis labore duis. Labore cupidatat anim. Sunt ullamco magna excepteur veniam non. Dolore adipisicing nulla. Lorem fugiat., Thu Jan 12 2017 03:02:29 GMT-0800 (PST), 680, 318, 1010, 6
248, 1071home0.jpg, 304.13, ea consequat eu, Duis dolore eiusmod nostrud consequat magna eu eu aute. Fugiat magna mollit do nostrud veniam proident aute., Rome, Cillum tempor. Minim eu Lorem deserunt. Tempor ea amet deserunt enim velit officia minim enim veniam. In fugiat nulla culpa., Mon Oct 12 2015 17:42:18 GMT-0700 (PDT), 146, 540, 1071, 6
249, 1056home0.jpg, 250.69, deserunt irure tempor, Velit cillum proident culpa sint occaecat minim amet sint. Laborum commodo velit nulla aliquip fugiat velit ad nostrud., Panama, Sunt incididunt anim reprehenderit excepteur aliqua. Sunt nisi proident mollit. Incididunt sit aliquip pariatur veniam sint occaecat., Wed Jul 19 2017 03:52:18 GMT-0700 (PDT), 680, 710, 1056, 6
250, 1050home0.jpg, 487.39, esse irure mollit, Minim tempor laborum proident elit ad do id. Cupidatat tempor ex labore fugiat dolor mollit., Cadiz, Laborum qui irure. Dolore excepteur quis nisi consequat nostrud. In nulla nostrud id aliqua in esse. Ut et ex qui sint laboris. Laboris do exercitation reprehenderit fugiat amet voluptate amet ipsum excepteur., Wed Jun 11 2014 11:42:57 GMT-0700 (PDT), 698, 76, 1050, 6
251, 1090home0.jpg, 894.20, nostrud excepteur qui, Nisi nisi laboris nisi occaecat ut aute nostrud. Labore adipisicing deserunt amet deserunt pariatur consectetur aute nostrud commodo., Venice, Et exercitation et duis aliquip. Consequat nostrud elit magna veniam ex quis. Dolore eu enim duis commodo eiusmod., Fri Oct 23 2015 15:54:49 GMT-0700 (PDT), 545, 151, 1090, 6
252, 1026home0.jpg, 812.31, aliquip proident fugiat, Id esse laborum elit duis. Quis veniam ut deserunt ea exercitation., Dublin, Eiusmod ex Lorem cillum do reprehenderit ad quis culpa. Lorem id aute eiusmod eu ex magna dolore et. Eiusmod est labore voluptate magna velit eu sit. Occaecat ullamco quis sint commodo pariatur. Pariatur dolore qui exercitation magna eiusmod. Elit culpa ex nisi Lorem enim id minim aute ea. Id veniam ad eiusmod proident ex voluptate laborum Lorem., Fri Feb 24 2017 12:32:44 GMT-0800 (PST), 143, 64, 1026, 6
253, 1024home0.jpg, 338.85, sunt elit reprehenderit, Eu dolor duis cupidatat dolore esse sunt consectetur. Aliquip occaecat adipisicing fugiat ullamco officia., Berlin, In tempor laboris reprehenderit ut. Eu enim velit exercitation ipsum reprehenderit ut. Incididunt fugiat culpa proident est quis. Occaecat officia. Ipsum cillum exercitation incididunt labore laborum culpa reprehenderit cupidatat. Ut nulla officia reprehenderit dolor elit excepteur aliqua velit id., Sun Sep 14 2014 13:32:35 GMT-0700 (PDT), 916, 859, 1024, 6
254, 1046home0.jpg, 703.10, do ipsum irure, Cupidatat enim reprehenderit amet cupidatat. Ullamco fugiat excepteur in esse., Rome, Proident sunt ea dolor cupidatat eu ea commodo quis. Laborum labore incididunt. Sit ex elit do. Qui fugiat., Sun Oct 07 2012 02:32:54 GMT-0700 (PDT), 673, 500, 1046, 6
255, 1066home0.jpg, 319.88, amet ut consectetur, Eiusmod cillum dolor id exercitation ullamco proident. Amet esse occaecat dolor sit est cillum commodo., Panama, Consequat deserunt ad et ea Lorem in. Occaecat ullamco enim aliqua magna. Dolore aliquip qui. Aliqua cupidatat ullamco amet laborum commodo laboris esse. Do proident ut., Fri Sep 14 2012 11:25:57 GMT-0700 (PDT), 505, 60, 1066, 6
256, 1068home0.jpg, 274.82, tempor mollit cupidatat, Incididunt nostrud elit quis labore aute occaecat Lorem pariatur reprehenderit. Laboris Lorem minim aute consequat dolore., Madrid, Adipisicing consequat laborum consequat eiusmod adipisicing. Duis duis adipisicing aliqua. Qui amet., Thu Oct 22 2015 09:34:47 GMT-0700 (PDT), 4, 182, 1068, 6
257, 1079home0.jpg, 226.59, ea magna veniam, Commodo id sunt nulla incididunt aute labore. Amet ut reprehenderit enim non., Paris, Laborum officia aliquip laboris sint aliqua consectetur. Elit commodo elit aliquip ea minim. Occaecat occaecat sunt eiusmod consequat eu excepteur. In labore amet anim tempor occaecat laboris amet nostrud velit. Aliqua ea ut culpa Lorem tempor irure. Id occaecat id reprehenderit deserunt. Enim adipisicing dolor incididunt incididunt., Wed Dec 12 2012 09:55:03 GMT-0800 (PST), 430, 271, 1079, 6
258, 1064home0.jpg, 270.36, laborum do proident, Nulla veniam officia sit non proident in velit. Deserunt irure deserunt ea est excepteur officia ipsum id minim., Berlin, Voluptate sit ex culpa tempor exercitation irure cillum ex. Voluptate ullamco incididunt est adipisicing. Aliqua incididunt est cillum aliquip., Fri Jun 16 2017 05:27:39 GMT-0700 (PDT), 577, 426, 1064, 6
259, 1038home0.jpg, 365.60, velit enim incididunt, Exercitation ex enim laborum consequat proident nostrud proident. Excepteur Lorem ut dolore eu cupidatat reprehenderit duis., Paris, Exercitation aute fugiat labore dolor nisi cillum consectetur. Velit incididunt ipsum ullamco reprehenderit eiusmod proident ut. Elit deserunt est voluptate ea veniam deserunt. Minim dolore dolor velit ipsum excepteur irure dolore reprehenderit nulla. Irure consequat officia ut magna. Sunt nisi cillum. Sit anim excepteur nostrud reprehenderit ipsum., Thu Jun 22 2017 13:23:00 GMT-0700 (PDT), 543, 935, 1038, 6
260, 1012home0.jpg, 735.25, dolor sint cupidatat, Nostrud Lorem pariatur nulla exercitation dolore dolor irure in. Cillum adipisicing deserunt officia amet ut sint non., Dublin, Culpa occaecat ullamco proident tempor. Anim nisi ullamco sit sit commodo exercitation. Enim adipisicing eu laborum ad nostrud sint non Lorem adipisicing. Irure veniam pariatur reprehenderit officia dolor cupidatat elit anim et. Nisi labore veniam laborum. Anim est non cupidatat veniam. Enim excepteur deserunt., Mon Sep 09 2013 01:55:44 GMT-0700 (PDT), 719, 995, 1012, 6
261, 1118home0.jpg, 732.20, pariatur occaecat pariatur, Amet deserunt laborum id nisi. Amet ut sint ullamco ut dolore aliquip., Venice, Officia quis excepteur esse pariatur aliquip enim sit eiusmod exercitation. Nisi aliqua proident dolor. Nulla minim minim ut minim excepteur ex dolor. Exercitation deserunt id incididunt incididunt quis culpa. Ut nulla irure excepteur amet deserunt aute consequat., Mon May 07 2018 01:49:02 GMT-0700 (PDT), 232, 541, 1118, 6
262, 1056home0.jpg, 879.24, cillum sit ex, Eiusmod pariatur non dolor laboris est officia commodo quis. Culpa ex sint velit in sit., London, Elit amet labore officia tempor. Ex irure cillum officia irure qui sint magna mollit. Quis exercitation nisi reprehenderit laborum ea id nisi sunt. Voluptate proident dolor minim cupidatat nostrud consectetur exercitation., Fri May 19 2017 00:37:47 GMT-0700 (PDT), 369, 836, 1056, 6
263, 1095home0.jpg, 643.61, officia ad officia, Sunt in cupidatat sit nisi ipsum. Aliqua nisi aliquip commodo aliquip minim incididunt ullamco., London, Dolore non excepteur. Excepteur magna non deserunt deserunt cupidatat sit culpa. Aliqua id nulla. Dolor amet labore non laborum esse. Adipisicing pariatur irure culpa reprehenderit ea in ipsum anim aliqua. Sunt tempor occaecat voluptate ut laborum. Ullamco proident voluptate cillum consectetur elit Lorem., Thu Jan 25 2018 16:18:51 GMT-0800 (PST), 881, 532, 1095, 6
264, 1039home0.jpg, 852.98, reprehenderit cillum adipisicing, Officia est magna tempor ea id ipsum eu aliqua consequat. Elit eu officia velit aliquip excepteur do consequat labore., Santorini, Dolor dolor nostrud velit amet. Elit nulla amet dolore. Proident non sit consequat id aliqua eiusmod do., Wed Mar 21 2012 08:33:11 GMT-0700 (PDT), 730, 560, 1039, 6
265, 1083home0.jpg, 66.96, qui do voluptate, Culpa id proident adipisicing ea dolore non nisi ad eiusmod. Consequat labore aute elit culpa aliquip ex quis deserunt., Santorini, Ipsum id consectetur aute consectetur. Id magna cupidatat est. Eiusmod eu eiusmod elit. Eiusmod quis., Wed Feb 11 2015 18:53:04 GMT-0800 (PST), 955, 802, 1083, 6
266, 1107home0.jpg, 374.18, aliquip officia dolore, Est velit nulla voluptate officia cillum. Quis do officia veniam nostrud deserunt., Mykonos, Qui eu consequat sit incididunt amet commodo culpa duis. Laboris nostrud mollit et qui sunt laboris eu tempor. Reprehenderit eiusmod irure duis ex voluptate. Cillum officia voluptate commodo exercitation. Est ut. Excepteur cillum consequat est labore officia. Non dolor enim reprehenderit ad duis do mollit., Tue Oct 14 2014 12:58:36 GMT-0700 (PDT), 476, 303, 1107, 6
267, 1091home0.jpg, 26.31, esse minim tempor, Consequat nostrud minim sit voluptate elit aliquip adipisicing. Fugiat non laborum consectetur ut nisi aliqua culpa., Mykonos, Lorem dolore Lorem. Adipisicing eu et nulla laboris ut. Nisi fugiat qui laborum consequat. Fugiat aute mollit. Ullamco nulla officia ipsum laboris est elit dolor do pariatur. Esse eiusmod consequat ex dolore. Amet elit aliquip incididunt dolore fugiat laborum reprehenderit veniam., Mon Dec 16 2013 03:49:03 GMT-0800 (PST), 209, 461, 1091, 6
268, 1077home0.jpg, 330.10, eiusmod nisi tempor, Sint non do elit mollit ipsum. Aliquip ut adipisicing laboris nostrud cupidatat duis mollit fugiat consequat., Santorini, Ad id cillum qui esse eu excepteur. Officia ad velit ex anim ex elit incididunt eu. Aute magna dolore eiusmod pariatur amet. Cupidatat consequat sunt occaecat ipsum occaecat elit laborum in. Eiusmod sint consectetur magna proident nulla consectetur officia., Fri May 01 2015 22:45:17 GMT-0700 (PDT), 235, 509, 1077, 6
269, 1046home0.jpg, 102.86, amet veniam cillum, Consectetur laborum enim adipisicing est Lorem ad consectetur. Consectetur duis in est officia proident sint., Paris, Dolore nisi adipisicing aliquip nisi. Quis proident id nostrud esse ipsum officia. Non ex eu tempor officia non officia reprehenderit consectetur., Thu May 26 2016 10:23:34 GMT-0700 (PDT), 943, 360, 1046, 6
270, 1071home0.jpg, 981.13, tempor proident ut, Cillum elit nostrud pariatur Lorem sit. Aliquip et in labore id sunt., Mykonos, Esse sint qui officia sunt commodo voluptate. Elit nulla pariatur velit pariatur amet officia ullamco Lorem esse. Veniam consequat anim ad., Tue Dec 05 2017 07:00:31 GMT-0800 (PST), 994, 511, 1071, 6
271, 1085home0.jpg, 998.35, pariatur non est, Ipsum aute culpa anim dolor voluptate duis anim. Exercitation laboris ut dolore adipisicing officia eiusmod nisi., Rome, Aliquip consequat nulla. Commodo sint dolore. Aliquip aute. Veniam aliquip fugiat proident adipisicing eiusmod aute. Excepteur cupidatat magna non commodo., Sun Mar 25 2018 00:21:48 GMT-0700 (PDT), 189, 372, 1085, 6
272, 1095home0.jpg, 624.14, do voluptate occaecat, Deserunt nulla enim culpa qui. Magna veniam veniam Lorem tempor ex deserunt mollit., Rome, Consequat sunt minim sunt aliquip minim magna. Deserunt irure exercitation ex pariatur est aliqua aliqua labore. Aliqua anim id ut nostrud amet laboris laboris quis., Sun Jul 05 2015 03:48:17 GMT-0700 (PDT), 252, 265, 1095, 6
273, 1083home0.jpg, 64.73, veniam amet eu, Duis adipisicing sint consequat aute qui cillum officia. Esse elit ad incididunt nisi., Rome, Adipisicing sunt reprehenderit eu consequat ex exercitation sit sint. Commodo id aliquip magna. Nostrud quis Lorem est nostrud fugiat elit. Officia elit magna. Exercitation excepteur. Ullamco deserunt excepteur dolor., Sun Jan 13 2013 02:56:32 GMT-0800 (PST), 505, 820, 1083, 6
274, 1051home0.jpg, 534.93, eiusmod irure est, Est qui minim commodo ullamco nisi. Lorem enim dolor amet aliqua., Rome, Id commodo ex. Id sint occaecat proident enim. Sint minim amet fugiat sint anim voluptate. Eu reprehenderit non minim esse incididunt cupidatat excepteur., Sun Mar 24 2013 09:13:38 GMT-0700 (PDT), 540, 933, 1051, 6
275, 1019home0.jpg, 161.16, cupidatat reprehenderit aute, Ullamco qui amet consequat velit excepteur culpa velit sit officia. Minim sunt do id aute deserunt., London, Amet incididunt exercitation nulla incididunt reprehenderit ipsum anim reprehenderit quis. Reprehenderit esse proident irure do sint qui adipisicing do. Non enim labore pariatur., Mon Nov 05 2012 00:49:28 GMT-0800 (PST), 194, 115, 1019, 6
276, 1028home0.jpg, 417.55, occaecat sit cupidatat, Mollit esse mollit proident officia ut adipisicing id nulla aute. Deserunt eiusmod duis voluptate dolor nostrud nisi., Berlin, Fugiat excepteur ut. Est et reprehenderit ut dolor ea excepteur minim voluptate enim. Fugiat magna nulla nisi non commodo adipisicing. Commodo fugiat labore laborum aute esse excepteur minim sint. Reprehenderit pariatur occaecat in dolor excepteur aute amet incididunt aliquip. Deserunt proident exercitation ad quis fugiat., Fri Oct 16 2015 04:24:43 GMT-0700 (PDT), 851, 420, 1028, 6
277, 1033home0.jpg, 5.09, elit ea quis, Sint velit do consectetur cupidatat. Enim in cupidatat nisi do ex magna eu aute., Barcelona, Eu pariatur consequat id. Aute et eiusmod. Ad do aliqua veniam pariatur amet. Excepteur aliquip ea culpa aliquip in nostrud adipisicing et., Fri Mar 27 2015 04:14:05 GMT-0700 (PDT), 935, 45, 1033, 6
278, 1076home0.jpg, 539.78, fugiat sunt nulla, Est eu ad duis amet. Culpa ut consectetur duis nisi esse anim Lorem., Cadiz, Laborum aute. Amet duis ex proident do. Minim exercitation enim proident anim commodo ut irure. Laborum commodo enim ea elit., Tue Dec 16 2014 12:59:31 GMT-0800 (PST), 61, 199, 1076, 6
279, 1111home0.jpg, 690.01, voluptate ex voluptate, Esse excepteur mollit ea magna. Laborum sit anim ex ipsum ipsum., Ibiza, Consequat do amet cupidatat mollit et commodo esse sit. Dolor deserunt pariatur adipisicing laboris laborum. Quis amet deserunt laborum enim nulla duis est. Laborum proident nisi sunt cupidatat. Duis enim et in. Sint amet elit elit duis esse laboris voluptate irure amet. Proident dolore do nisi do laboris laboris Lorem sint fugiat., Fri Oct 04 2013 08:00:28 GMT-0700 (PDT), 995, 632, 1111, 6
280, 1106home0.jpg, 988.09, tempor non Lorem, Cillum qui ex nisi qui ullamco. Aute aliqua magna veniam in proident ad deserunt cupidatat., Dublin, Magna voluptate nostrud veniam fugiat quis ea exercitation. Excepteur in consectetur elit ex incididunt pariatur ea deserunt. In occaecat nostrud do duis. Eu enim cupidatat tempor duis consectetur est laborum voluptate. Lorem est duis dolore veniam consectetur dolore esse culpa aliquip., Mon Sep 14 2015 18:59:37 GMT-0700 (PDT), 283, 875, 1106, 6
281, 1012home0.jpg, 16.96, sit consequat enim, Velit irure et excepteur irure labore esse. Tempor aliqua esse sint eiusmod fugiat excepteur tempor nisi., Paris, Nisi exercitation ea. Reprehenderit velit laborum non tempor mollit est ut culpa. Aliquip amet mollit Lorem ad eu consequat ut laborum. Ut enim cupidatat. Ipsum minim exercitation officia., Fri Jul 04 2014 21:05:38 GMT-0700 (PDT), 798, 205, 1012, 6
282, 1011home0.jpg, 931.62, aliquip in anim, Adipisicing esse cupidatat adipisicing ut do est deserunt cillum reprehenderit. Reprehenderit amet ipsum anim ea anim laborum aute velit Lorem., Cadiz, Exercitation elit. In magna aliqua ea. Enim consectetur veniam enim cupidatat consequat excepteur ad aliqua Lorem. Aute officia magna est est Lorem proident. Reprehenderit mollit officia ipsum esse. Pariatur eiusmod eiusmod elit mollit., Fri Jun 01 2012 20:26:26 GMT-0700 (PDT), 836, 274, 1011, 6
283, 1055home0.jpg, 470.63, sunt laborum quis, Deserunt nostrud reprehenderit exercitation adipisicing proident ipsum excepteur cupidatat. In elit labore ullamco pariatur sunt deserunt aliquip., Ibiza, Labore quis. Velit deserunt ut aliqua. Et nisi dolore non dolore laboris deserunt ea. Deserunt nostrud laboris duis reprehenderit ex ullamco. Amet eiusmod dolor amet esse esse non ex. Magna commodo ad labore. Cillum cupidatat irure incididunt anim aute magna consequat esse., Thu Nov 13 2014 02:25:44 GMT-0800 (PST), 508, 756, 1055, 6
284, 1085home0.jpg, 189.81, consectetur excepteur sit, Sint do dolor qui labore sit fugiat. Mollit sit duis ullamco deserunt qui consequat do., Venice, Voluptate qui aliqua voluptate pariatur. Dolore nulla exercitation amet culpa. Nisi eiusmod ullamco eu exercitation. Ad voluptate. Elit culpa ut cillum fugiat minim est ullamco eiusmod. Amet tempor do ipsum et cillum cupidatat eiusmod eiusmod. Deserunt ut est tempor tempor aliquip nulla., Thu Feb 23 2017 17:05:51 GMT-0800 (PST), 502, 323, 1085, 6
285, 1042home0.jpg, 521.98, fugiat sit aute, Ut commodo ex ut voluptate ut irure enim. Aliqua non nostrud ea veniam incididunt consectetur in sunt., London, Mollit eu incididunt sit. Et culpa adipisicing veniam quis sint laboris officia dolor. Nulla quis. Cillum labore do excepteur. Ex duis magna qui dolore amet. Pariatur in officia reprehenderit sint exercitation dolor do enim. Fugiat Lorem ad., Mon Jul 06 2015 15:12:00 GMT-0700 (PDT), 912, 973, 1042, 6
286, 1099home0.jpg, 5.12, nulla laborum aliquip, In ullamco cillum ex qui aliquip sint enim occaecat. Fugiat elit enim officia ex est dolore., Mykonos, Elit voluptate cupidatat eu culpa. Sit duis reprehenderit. Qui ex cupidatat ea. Adipisicing nisi sint ex irure anim commodo., Mon Dec 02 2013 20:38:20 GMT-0800 (PST), 891, 476, 1099, 6
287, 1091home0.jpg, 773.00, deserunt irure quis, Occaecat esse Lorem id aliquip qui sunt duis irure. Veniam consectetur culpa nisi est adipisicing amet culpa incididunt id., London, Elit nostrud sunt nulla. Adipisicing esse voluptate culpa fugiat sint dolor. Aliqua consectetur commodo eu eu ullamco quis incididunt ad exercitation. Nisi in dolor aliquip esse et nulla sint. Consequat id laboris laboris cillum elit. Duis occaecat proident cillum quis officia quis officia deserunt. Eu nisi amet sint ipsum enim velit nisi., Sun Apr 13 2014 22:18:21 GMT-0700 (PDT), 540, 449, 1091, 6
288, 1020home0.jpg, 85.09, sunt sit sunt, Velit labore culpa officia exercitation. Pariatur duis nostrud ullamco eu excepteur do., Venice, Fugiat elit. Anim veniam velit minim. Duis reprehenderit sit consectetur culpa ea. Esse esse in in cillum proident sunt minim. Duis labore sit enim nulla esse fugiat in., Wed Aug 31 2016 11:49:01 GMT-0700 (PDT), 909, 563, 1020, 6
289, 1112home0.jpg, 312.52, incididunt sunt excepteur, Reprehenderit ad esse do enim ullamco eiusmod dolore sunt. Elit reprehenderit reprehenderit ipsum qui nostrud non laborum mollit., Cadiz, Duis nostrud amet ad voluptate incididunt ad aute. Nisi ea laborum. Elit culpa reprehenderit. Dolore incididunt., Mon Apr 09 2018 05:43:08 GMT-0700 (PDT), 242, 858, 1112, 6
290, 1015home0.jpg, 632.85, proident duis qui, Duis officia voluptate nulla consequat commodo cupidatat exercitation veniam reprehenderit. Dolore labore quis cillum irure aute velit incididunt proident mollit., Cadiz, Duis officia Lorem pariatur incididunt est sit veniam laboris quis. Ex adipisicing ut. Deserunt deserunt velit., Fri Dec 15 2017 23:30:21 GMT-0800 (PST), 86, 369, 1015, 6
291, 1008home0.jpg, 58.62, labore fugiat cillum, Excepteur aliquip est irure Lorem sint excepteur est duis qui. Eiusmod dolor excepteur dolor sint velit labore aliquip voluptate., London, Minim nisi adipisicing ex exercitation. Quis nisi aliqua. Aliquip culpa quis do cupidatat tempor exercitation aliqua. Sit aliqua velit labore laboris. Sit amet qui officia in proident adipisicing sit., Sat Jan 28 2012 11:38:05 GMT-0800 (PST), 550, 464, 1008, 6
292, 1051home0.jpg, 490.50, voluptate laborum exercitation, Labore sunt excepteur exercitation occaecat ex ullamco commodo veniam esse. Ullamco nisi sint pariatur labore cillum anim adipisicing., Santorini, Reprehenderit ad ex sunt sunt quis deserunt. Ex quis elit reprehenderit non sit aliquip veniam. Nisi consectetur eu anim velit consectetur id magna., Thu Oct 15 2015 22:29:06 GMT-0700 (PDT), 778, 280, 1051, 6
293, 1075home0.jpg, 870.85, dolore id consectetur, Aliquip ex aute sunt in occaecat enim. Ullamco incididunt officia qui irure id reprehenderit dolor., Santorini, Irure aliquip. Amet nulla nostrud nisi adipisicing ad. Est adipisicing minim magna., Sun Sep 24 2017 10:42:53 GMT-0700 (PDT), 746, 267, 1075, 6
294, 1013home0.jpg, 163.72, laborum officia consequat, Enim voluptate enim do ex. Aliquip Lorem excepteur id cillum consequat eu ut deserunt duis., Rome, In eiusmod. Eu ipsum dolore minim sint cupidatat sint dolore. Proident ex officia Lorem elit pariatur exercitation laboris., Mon Jul 03 2017 15:41:30 GMT-0700 (PDT), 28, 471, 1013, 6
295, 1110home0.jpg, 760.86, fugiat anim cupidatat, Duis minim non aliquip nulla dolore sit. Minim amet nostrud culpa aliquip incididunt., Panama, Quis in incididunt irure culpa minim. Enim mollit labore et veniam aliquip reprehenderit adipisicing. Ullamco et fugiat. Mollit ipsum tempor. Do et occaecat nulla nulla labore ut tempor pariatur deserunt., Wed Nov 22 2017 11:57:38 GMT-0800 (PST), 641, 134, 1110, 6
296, 1044home0.jpg, 274.09, duis culpa sit, Adipisicing pariatur reprehenderit qui consequat dolor enim laboris aute nisi. Minim sunt exercitation labore esse id tempor sunt., Mykonos, Reprehenderit enim. Tempor pariatur exercitation aliqua ea anim proident ipsum duis minim. Consectetur veniam officia occaecat cillum consequat ad deserunt. Quis est mollit in velit commodo aliqua est commodo officia., Wed Apr 08 2015 19:36:49 GMT-0700 (PDT), 11, 871, 1044, 6
297, 1058home0.jpg, 132.51, ad eiusmod quis, Qui anim amet veniam exercitation. Commodo consequat mollit est veniam commodo exercitation nostrud., Barcelona, Lorem ad do laborum. Incididunt proident. Excepteur commodo amet occaecat est incididunt tempor., Thu Nov 28 2013 23:44:12 GMT-0800 (PST), 457, 271, 1058, 6
298, 1103home0.jpg, 993.64, commodo reprehenderit cupidatat, Culpa laborum ad incididunt ad. Ad aute ad enim et adipisicing sint ea sint., Santorini, Sint irure occaecat culpa sint adipisicing eu quis ipsum adipisicing. Deserunt cillum qui proident nostrud consectetur adipisicing nisi. Reprehenderit anim ullamco est et labore ullamco. Ea voluptate tempor ex ullamco sunt excepteur magna cillum sit., Wed Feb 10 2016 15:55:08 GMT-0800 (PST), 250, 582, 1103, 6
299, 1100home0.jpg, 762.79, ut aliquip culpa, Reprehenderit veniam incididunt pariatur laboris aliquip voluptate velit laborum dolor. Consectetur nisi aliqua consectetur voluptate incididunt exercitation voluptate in., Venice, Esse excepteur id sit velit ipsum. Ut Lorem nostrud consectetur enim voluptate non eiusmod quis deserunt. Dolor officia sint nulla elit occaecat duis incididunt., Sun Mar 18 2012 09:43:34 GMT-0700 (PDT), 738, 593, 1100, 6
300, 1099home0.jpg, 45.25, commodo dolor magna, Nostrud labore reprehenderit deserunt ipsum veniam deserunt. Incididunt dolor quis et aute., Paris, Eiusmod voluptate. Nulla nulla ad id sunt aute ullamco anim. Fugiat minim ex sunt. Anim tempor adipisicing eu. Occaecat excepteur ut est fugiat. Labore esse., Tue Oct 08 2013 07:26:40 GMT-0700 (PDT), 121, 871, 1099, 6
301, 1017home0.jpg, 13.00, aliquip consectetur id, Esse ea pariatur aliqua voluptate nisi qui nisi exercitation est. Ullamco culpa labore reprehenderit dolore., Dublin, Nostrud Lorem et magna. Do culpa. In ea duis aliquip. Consequat commodo sit Lorem., Mon Apr 25 2016 00:25:44 GMT-0700 (PDT), 400, 640, 1017, 6
302, 1006home0.jpg, 698.57, reprehenderit officia amet, Sint cillum magna magna dolor nostrud. Anim qui quis ullamco ullamco culpa veniam., Venice, Sint Lorem irure consectetur proident voluptate eiusmod. Fugiat quis aliquip magna nostrud reprehenderit quis. Ullamco deserunt ea., Mon Jan 21 2013 07:05:48 GMT-0800 (PST), 783, 472, 1006, 6
303, 1111home0.jpg, 973.34, amet labore laboris, Non sint non ex Lorem officia ea. Ex quis aliqua minim voluptate enim velit duis., Dublin, Est velit. Deserunt anim do irure irure eiusmod sint. Enim et excepteur ut qui aliquip eu dolor tempor. Veniam ullamco sint eu consequat est incididunt est. Nisi qui. Exercitation ullamco elit., Thu Apr 14 2016 23:23:17 GMT-0700 (PDT), 651, 466, 1111, 6
304, 1006home0.jpg, 281.50, nostrud aliquip reprehenderit, Ipsum veniam sit Lorem sint quis consequat sunt consequat mollit. Dolore deserunt elit consequat deserunt tempor., Cadiz, Laboris eu duis. Sit sint consectetur consectetur. Dolor sint., Sat Mar 23 2013 22:56:09 GMT-0700 (PDT), 489, 29, 1006, 6
305, 1027home0.jpg, 683.05, nostrud minim amet, Est laborum ad cillum aliqua aliqua duis tempor. Cillum velit id nulla officia officia., Rome, Fugiat quis magna magna anim qui id. Elit laboris officia ipsum Lorem voluptate eiusmod aute. Est et deserunt do ipsum esse. Officia eu. Occaecat sunt qui. Minim nostrud amet aliqua dolor ea commodo sunt consequat. Tempor est sint et fugiat laboris mollit magna cupidatat fugiat., Sun Nov 10 2013 14:45:48 GMT-0800 (PST), 453, 386, 1027, 6
306, 1058home0.jpg, 497.00, cupidatat esse labore, Excepteur exercitation proident duis culpa id ipsum. Pariatur magna ut cillum consectetur aliqua., Cadiz, Lorem pariatur. Adipisicing esse consectetur voluptate nostrud dolor. Laborum consectetur ea anim. Adipisicing irure elit elit. In proident mollit excepteur minim officia laborum. Minim id ex. Occaecat dolor sunt consectetur., Mon Mar 14 2016 05:52:18 GMT-0700 (PDT), 659, 661, 1058, 6
