725, 1068home0.jpg, 868.64, dolore anim voluptate, Nisi aliqua reprehenderit voluptate commodo enim est dolor ipsum in. Dolor eiusmod ut sunt id nisi., Venice, Do labore labore esse. Sit nisi in in aute culpa culpa. Ullamco occaecat amet minim duis incididunt aliquip excepteur ea est. Labore cupidatat pariatur nisi est occaecat sunt incididunt eiusmod incididunt., Sat Aug 22 2015 08:42:01 GMT-0700 (PDT), 378, 866, 1068, 6
726, 1116home0.jpg, 999.46, est exercitation ipsum, Officia elit nisi excepteur nulla. Nulla ad cillum eiusmod mollit amet magna sunt laboris nisi., Panama, Aliquip id do officia laborum proident. Nisi voluptate nisi quis sint nisi amet. Labore est amet cillum id ea deserunt laboris dolore aute., Thu Dec 28 2017 20:26:34 GMT-0800 (PST), 654, 200, 1116, 6
727, 1076home0.jpg, 156.57, ea duis esse, Nisi in mollit amet aliquip exercitation cupidatat. Pariatur qui exercitation eiusmod nisi magna pariatur occaecat quis proident., Cadiz, Occaecat laborum consectetur aliquip minim consequat amet. Amet duis mollit laboris dolore ullamco ex labore. Esse eiusmod deserunt nostrud culpa ea. Fugiat exercitation anim ipsum. Incididunt enim esse consequat duis ut excepteur sint., Fri Mar 06 2015 11:55:10 GMT-0800 (PST), 492, 310, 1076, 6
728, 1058home0.jpg, 96.28, magna tempor adipisicing, Consequat magna ipsum voluptate non nisi amet esse excepteur. Culpa eu est culpa quis velit ut in., Barcelona, Ipsum proident dolore officia culpa in ullamco eiusmod voluptate commodo. Occaecat ullamco magna id enim voluptate eiusmod aliqua Lorem irure. Exercitation occaecat nulla nisi sint et id deserunt. Ullamco voluptate nisi officia occaecat mollit. Velit est ea esse officia. Tempor voluptate voluptate exercitation culpa esse laboris eiusmod incididunt., Sat Dec 27 2014 22:29:33 GMT-0800 (PST), 194, 191, 1058, 6
729, 1031home0.jpg, 922.60, ex aute minim, Aute est in adipisicing officia. Laboris consequat in consequat exercitation ad consectetur irure reprehenderit., Barcelona, Ex sint in aute incididunt. Reprehenderit labore. Duis culpa adipisicing mollit occaecat enim do consequat velit. Deserunt quis et nisi ea do. Do eu laborum ut fugiat elit anim irure. Laboris et., Wed Dec 23 2015 22:07:43 GMT-0800 (PST), 381, 690, 1031, 6
730, 1083home0.jpg, 739.92, aliqua sunt duis, Incididunt laborum ex nisi adipisicing cupidatat minim cillum sit deserunt. Id in dolore qui eu Lorem., Venice, In in. Sit id magna cupidatat excepteur id velit pariatur. Elit irure ut qui dolor ad sunt labore. Magna aliquip nisi sunt officia aute magna. Ipsum anim. Labore officia eu deserunt deserunt do. Nostrud culpa adipisicing occaecat tempor deserunt in., Thu Nov 12 2015 02:27:15 GMT-0800 (PST), 978, 81, 1083, 6
731, 1086home0.jpg, 928.31, ut anim est, Non occaecat irure occaecat ipsum esse aliquip. Minim veniam do elit ea proident ullamco., Cadiz, Irure commodo. Commodo mollit Lorem deserunt non eu incididunt cupidatat in. Excepteur mollit minim. Sunt ex Lorem quis amet magna. Aute excepteur minim velit veniam ad elit ad tempor deserunt., Sat Aug 08 2015 18:37:08 GMT-0700 (PDT), 679, 674, 1086, 6
732, 1094home0.jpg, 482.53, incididunt esse ad, Culpa laboris incididunt excepteur aliquip incididunt ullamco irure. Veniam esse aliquip id quis sunt est aute., Berlin, Amet labore nisi. Commodo incididunt voluptate id et ipsum. Ea proident qui magna aliqua id eu labore. Nisi sit sunt mollit Lorem consequat laboris. Ipsum do dolor pariatur laboris laboris irure. Qui occaecat proident mollit et laboris est aliquip. Qui ea duis exercitation., Wed Nov 13 2013 02:48:13 GMT-0800 (PST), 553, 158, 1094, 6
733, 1010home0.jpg, 252.18, laborum do enim, Reprehenderit non officia enim enim. Veniam aute laboris non duis dolore., Mykonos, Tempor aliquip do commodo in ullamco non esse voluptate. Excepteur laboris tempor fugiat laboris anim ut amet voluptate magna. Aliquip voluptate sunt eu nisi eu. Enim labore ullamco., Sat Sep 01 2012 14:22:05 GMT-0700 (PDT), 216, 784, 1010, 6
734, 1008home0.jpg, 348.17, est aliquip do, Minim irure fugiat exercitation id Lorem. Laborum laboris sit laborum amet adipisicing duis sunt commodo., Madrid, Voluptate ex voluptate excepteur. Et ullamco ad. Elit dolore consequat dolore qui dolore magna ut sunt non. Sunt mollit do voluptate laborum. Veniam tempor adipisicing., Fri Jun 28 2013 11:03:06 GMT-0700 (PDT), 801, 182, 1008, 6
735, 1022home0.jpg, 449.32, eiusmod ut ea, Culpa et irure amet non do deserunt cillum minim commodo. Voluptate magna sit dolor velit ipsum aliquip dolore aliquip., Madrid, Dolor Lorem. Ipsum elit tempor anim ullamco. Do aliquip eiusmod fugiat duis labore aliquip. Sit ut aliquip aliqua laborum commodo., Mon Nov 11 2013 01:04:57 GMT-0800 (PST), 161, 279, 1022, 6
736, 1067home0.jpg, 942.68, qui laboris fugiat, Commodo in magna tempor aute duis pariatur consequat. Sit irure reprehenderit ipsum proident elit sunt ut irure., Paris, Sunt mollit eiusmod. Occaecat minim consequat deserunt excepteur culpa non. Ea velit dolore. Laborum ullamco consequat ullamco fugiat. Culpa do. Minim aute esse ad. Culpa pariatur., Mon Jun 20 2016 07:43:11 GMT-0700 (PDT), 423, 619, 1067, 6
737, 1071home0.jpg, 44.38, est officia deserunt, Ad irure cupidatat minim proident tempor nisi et quis nulla. Est esse Lorem esse id duis., Rome, Consectetur id cupidatat incididunt ut. Duis consectetur. Id ex duis culpa cupidatat et aute ut ullamco. Magna amet proident. Tempor sunt amet exercitation exercitation. Eiusmod enim minim sunt qui excepteur reprehenderit., Wed Jun 19 2013 00:15:12 GMT-0700 (PDT), 632, 334, 1071, 6
738, 1117home0.jpg, 168.99, enim duis laborum, Amet veniam culpa laborum ex. Excepteur est sit aliqua ea fugiat amet., London, Laborum reprehenderit ipsum cupidatat proident dolore proident velit officia adipisicing. Tempor est. Laboris aute velit. Proident amet mollit anim aute esse fugiat. Deserunt adipisicing incididunt sunt eiusmod dolore ut mollit sint. Non esse irure ullamco., Mon May 23 2016 02:03:31 GMT-0700 (PDT), 965, 26, 1117, 6
739, 1113home0.jpg, 370.61, irure irure est, Ullamco exercitation laboris incididunt laborum. Nostrud minim sunt aliquip qui irure., Panama, Voluptate laboris ipsum consectetur cillum eu. Exercitation eiusmod dolore ipsum voluptate ex. Mollit sit aliqua esse et. Culpa esse ut., Sat Aug 08 2015 03:58:36 GMT-0700 (PDT), 676, 805, 1113, 6
740, 1105home0.jpg, 865.36, duis Lorem ex, Nulla aliquip officia qui eiusmod ea ex dolore adipisicing non. Aute veniam Lorem tempor deserunt duis consectetur consequat cupidatat., Rome, Elit eu. Sint culpa qui sint veniam laborum excepteur ipsum enim aliqua. Minim nisi mollit quis. Ipsum ipsum labore minim sit nulla do sint esse consectetur. Cupidatat labore nisi dolor veniam aliquip nisi laborum nostrud do., Wed Apr 01 2015 05:26:02 GMT-0700 (PDT), 625, 396, 1105, 6
741, 1107home0.jpg, 999.99, velit ad nostrud, Fugiat tempor est dolore duis laboris. Officia sint culpa adipisicing sunt., Venice, Exercitation ullamco fugiat ullamco. Proident fugiat tempor ut cupidatat non qui aliquip. Sint exercitation labore. Consectetur non laborum eu ipsum ut occaecat est consequat., Sun Aug 24 2014 04:30:38 GMT-0700 (PDT), 365, 383, 1107, 6
742, 1096home0.jpg, 365.45, enim nostrud do, Nisi elit incididunt sint pariatur nostrud. Commodo aute proident cillum tempor ex excepteur id aliquip occaecat., Berlin, Non commodo nulla. Non eiusmod. Laboris ullamco. Magna commodo. Cupidatat proident officia magna commodo ea. Consectetur et minim. Laborum duis adipisicing velit elit., Thu Jun 29 2017 03:34:31 GMT-0700 (PDT), 728, 68, 1096, 6
743, 1040home0.jpg, 164.17, quis ex sint, Officia dolor tempor Lorem amet sint enim amet enim commodo. Eu et pariatur ullamco nulla adipisicing commodo ipsum et ea., Panama, Culpa Lorem cillum dolor deserunt. Reprehenderit ad ut ad aliquip nulla. Amet ullamco incididunt. Anim do culpa tempor ad incididunt nulla non. Veniam consectetur eu. Ad excepteur commodo aliqua., Mon Jun 17 2013 05:29:11 GMT-0700 (PDT), 96, 139, 1040, 6
744, 1070home0.jpg, 155.46, tempor cillum incididunt, Consequat elit sit in exercitation occaecat. Sunt reprehenderit elit incididunt culpa cillum laborum., Madrid, Eiusmod duis nisi. Sit exercitation nisi adipisicing qui tempor cillum sunt. Laborum sunt. Reprehenderit pariatur. Irure ea magna sit nulla sunt quis velit. Et tempor., Wed Sep 20 2017 13:43:36 GMT-0700 (PDT), 795, 943, 1070, 6
745, 1004home0.jpg, 388.84, eiusmod cupidatat quis, Ullamco voluptate excepteur eiusmod eiusmod adipisicing elit id sunt adipisicing. Dolor tempor esse nostrud ullamco consequat., Cadiz, Fugiat qui tempor. Nulla magna qui aliqua. Sunt proident. Nulla aliqua. Proident fugiat et qui incididunt minim. Consectetur sit nulla dolor., Thu Jul 14 2016 14:54:27 GMT-0700 (PDT), 520, 456, 1004, 6
746, 1097home0.jpg, 294.33, deserunt eiusmod nostrud, Labore sint fugiat reprehenderit reprehenderit aute dolore. Adipisicing commodo aliquip dolore mollit cupidatat anim laborum aliquip., Paris, In voluptate incididunt amet qui velit cupidatat. Incididunt et eu adipisicing fugiat. Reprehenderit ut adipisicing enim ex laboris quis nisi. Dolore dolor adipisicing amet., Fri Oct 10 2014 15:18:43 GMT-0700 (PDT), 432, 512, 1097, 6
747, 1050home0.jpg, 297.01, labore qui ea, Laboris adipisicing commodo excepteur aliqua officia nostrud labore elit. Ex ipsum Lorem eu occaecat incididunt id enim duis., Cadiz, Tempor fugiat voluptate eu consequat proident nisi non voluptate minim. Ad deserunt ea elit laborum laborum commodo nisi. Minim consequat id excepteur. Voluptate veniam. Officia dolore consequat ullamco aliqua duis., Wed Nov 26 2014 20:25:31 GMT-0800 (PST), 503, 659, 1050, 6
748, 1035home0.jpg, 743.63, ipsum nisi ad, Dolor incididunt Lorem enim commodo ea elit. Commodo irure deserunt nisi enim dolore voluptate aute fugiat., Berlin, In in voluptate et enim voluptate id amet eu Lorem. Dolor minim ipsum non aliquip enim ullamco incididunt consectetur eu. Dolor veniam exercitation exercitation laboris cillum sint ut consectetur esse. Consectetur reprehenderit dolore cupidatat nulla minim nostrud. Mollit amet consectetur cillum. Ut aliqua eiusmod. Incididunt officia ipsum minim ea., Fri Oct 23 2015 11:59:38 GMT-0700 (PDT), 196, 230, 1035, 6
749, 1113home0.jpg, 720.07, sunt sit id, Cupidatat dolore nulla cillum consectetur esse. Ea sit aliqua exercitation anim incididunt., Berlin, Commodo cupidatat magna do reprehenderit eiusmod magna. Qui sunt exercitation cillum aliqua velit amet laboris anim. Nulla ad. Culpa laborum aliquip eu ex eu proident officia proident consequat. Enim irure sint laborum magna. Irure ut nostrud ea adipisicing incididunt est., Thu Dec 22 2016 23:03:44 GMT-0800 (PST), 815, 794, 1113, 6
750, 1112home0.jpg, 512.70, fugiat et qui, Eu minim excepteur pariatur mollit. Est aliqua in Lorem adipisicing., Barcelona, Sint voluptate tempor nostrud ipsum aliquip sit do irure. Non aliquip consectetur incididunt duis qui irure eu. Exercitation mollit incididunt deserunt adipisicing nostrud nostrud. Amet ea ea sint in. Consectetur nulla proident culpa id., Mon Mar 13 2017 10:39:55 GMT-0700 (PDT), 650, 287, 1112, 6
751, 1101home0.jpg, 20.53, eu quis aliquip, Dolor fugiat est laborum exercitation. Deserunt dolore minim Lorem ex veniam., Dublin, Do reprehenderit cupidatat ex laboris ad. Cillum tempor qui pariatur ullamco. Cupidatat nulla non ipsum. Eu ea reprehenderit., Tue Feb 05 2013 07:49:19 GMT-0800 (PST), 378, 42, 1101, 6
752, 1119home0.jpg, 915.60, eiusmod deserunt incididunt, Quis do consequat quis duis cillum exercitation. Cillum exercitation ullamco minim cupidatat proident non., Dublin, Consequat occaecat magna eu deserunt est id amet. Velit enim. Consectetur adipisicing est ipsum commodo enim. Minim cupidatat cupidatat eiusmod Lorem duis est dolor minim cupidatat., Thu Nov 01 2012 20:12:15 GMT-0700 (PDT), 578, 527, 1119, 6
753, 1001home0.jpg, 719.69, voluptate ut fugiat, Aliqua fugiat adipisicing est incididunt fugiat cillum exercitation. Excepteur in anim cupidatat magna laborum cupidatat cupidatat., Mykonos, Nostrud nulla excepteur commodo consequat aute voluptate. Et veniam amet minim et. Veniam ex. Ipsum duis. Nisi anim labore mollit consequat cillum. Anim incididunt occaecat. Eiusmod eiusmod deserunt qui consectetur excepteur nulla dolore cillum., Sat Apr 08 2017 00:50:11 GMT-0700 (PDT), 185, 162, 1001, 6
754, 1003home0.jpg, 421.63, laboris mollit aliqua, Duis sint exercitation est nulla esse ipsum. Fugiat dolore adipisicing sunt enim sit quis labore occaecat commodo., Madrid, Sint laborum excepteur. Occaecat consectetur consectetur commodo. Ullamco minim eu sint magna incididunt cillum commodo irure. Est sunt mollit elit sunt. Magna qui esse cillum fugiat enim., Wed Jul 01 2015 02:47:27 GMT-0700 (PDT), 288, 544, 1003, 6
755, 1055home0.jpg, 882.45, velit irure ullamco, Enim excepteur deserunt tempor qui duis id ullamco sunt. Esse culpa elit ut exercitation incididunt laboris id., Mykonos, Non irure consectetur. Lorem velit ipsum amet velit voluptate fugiat cupidatat do mollit. Commodo sit aliquip exercitation ex dolore anim. Aliqua et anim minim dolor proident est. Consectetur sint nostrud cupidatat laboris exercitation excepteur veniam sunt officia. Voluptate ad ipsum ex sit officia ipsum ullamco., Sat Nov 29 2014 07:48:47 GMT-0800 (PST), 84, 443, 1055, 6
756, 1039home0.jpg, 760.53, cillum ut magna, In adipisicing quis sunt duis anim. Eu duis elit aute nisi ipsum., Paris, Ea do exercitation incididunt velit. Adipisicing qui in reprehenderit mollit. Excepteur cupidatat eu anim. Qui aute., Sat Feb 10 2018 16:56:56 GMT-0800 (PST), 222, 655, 1039, 6
757, 1018home0.jpg, 498.76, non quis elit, Est adipisicing aliqua eu cupidatat est. Nulla ad sint id duis amet nostrud duis., Panama, Esse esse aliqua. Proident consequat anim esse ullamco irure eu. Dolor dolore. Eu ex veniam incididunt. Sit enim., Fri Aug 24 2012 07:47:42 GMT-0700 (PDT), 742, 225, 1018, 6
758, 1092home0.jpg, 574.88, commodo labore minim, Eu et do exercitation cupidatat. Labore do in proident qui., Mykonos, Enim do deserunt elit nulla. Sint sit dolore veniam deserunt ea eu enim. Commodo ad duis nulla exercitation. Sit ea aliqua quis anim tempor aute., Sun Aug 13 2017 11:50:51 GMT-0700 (PDT), 275, 545, 1092, 6
759, 1009home0.jpg, 957.61, dolore ipsum incididunt, Nulla in ex eiusmod consequat id dolor ut ea. Dolor sint aliquip magna commodo nostrud culpa aliqua enim., Paris, Mollit consequat. Ad cupidatat et culpa dolor do aute. Voluptate sunt nostrud enim nisi est. Minim amet esse., Tue Mar 07 2017 02:38:23 GMT-0800 (PST), 329, 794, 1009, 6
760, 1078home0.jpg, 223.88, qui sint consequat, Nulla ipsum reprehenderit reprehenderit voluptate aliqua excepteur. Ex eiusmod incididunt culpa exercitation tempor., Berlin, Deserunt do quis dolore occaecat. Commodo incididunt laboris velit eu dolore eiusmod nisi. Laboris et sunt eu deserunt. Anim ea eu Lorem culpa minim. Non sunt laboris., Tue Mar 15 2016 15:02:27 GMT-0700 (PDT), 777, 545, 1078, 6
761, 1050home0.jpg, 620.09, irure duis dolore, Consequat incididunt dolore laborum ut elit consequat non excepteur. Proident laborum pariatur sunt eiusmod., Ibiza, Enim magna ut consectetur eiusmod deserunt. Enim ex aute sint excepteur. Ipsum irure elit. Dolor laboris quis sunt. Elit ullamco exercitation mollit eu ad aute consectetur dolor., Mon Dec 12 2016 22:52:48 GMT-0800 (PST), 458, 6, 1050, 6
762, 1084home0.jpg, 755.47, voluptate incididunt consectetur, Id excepteur quis dolore commodo deserunt voluptate ut. Est ipsum esse ea voluptate eu., Venice, Elit ea sunt eiusmod minim officia elit esse mollit labore. Ipsum est labore fugiat. Amet occaecat voluptate., Thu May 05 2016 20:27:16 GMT-0700 (PDT), 586, 222, 1084, 6
763, 1095home0.jpg, 917.42, non voluptate aliqua, Lorem et incididunt officia consequat ea pariatur quis. Ea mollit deserunt nisi consectetur quis., Berlin, Nulla nisi sit reprehenderit aliquip consectetur mollit proident Lorem nulla. Aliqua culpa. Consectetur officia aliqua non sint. Voluptate dolor est Lorem ut velit nulla. Adipisicing consectetur minim. Laborum anim incididunt quis consequat aute ex et dolor occaecat., Sun Jul 24 2016 16:00:14 GMT-0700 (PDT), 187, 570, 1095, 6
764, 1024home0.jpg, 898.91, quis voluptate irure, Proident mollit qui fugiat nisi. Nostrud nisi esse anim exercitation veniam laborum Lorem., Mykonos, Do ullamco incididunt minim dolor deserunt sit. Consectetur mollit eu adipisicing quis consectetur ad. Lorem minim in sunt sunt pariatur. Exercitation dolor consequat aute magna. Sunt mollit ex officia deserunt. Labore elit laborum incididunt nulla., Thu Nov 21 2013 23:04:50 GMT-0800 (PST), 987, 228, 1024, 6
765, 1075home0.jpg, 410.12, elit ut minim, Consequat nisi excepteur aute officia nulla. Laborum sint dolor occaecat commodo., Berlin, Aliqua sit reprehenderit laborum excepteur. Proident nisi est consectetur nisi id commodo. Ut commodo et voluptate excepteur esse enim ex ullamco ad. Elit occaecat fugiat commodo ea occaecat commodo laborum eu. Reprehenderit pariatur nulla enim sunt ipsum ex magna duis., Sun Nov 30 2014 15:41:33 GMT-0800 (PST), 798, 70, 1075, 6
766, 1029home0.jpg, 258.32, culpa labore reprehenderit, Reprehenderit magna duis ex consectetur. Pariatur irure voluptate commodo nulla irure., Venice, Pariatur magna consequat. Exercitation dolor aute eu cupidatat ex. Eu nisi incididunt. Nisi labore excepteur. Sint amet ut et. Ad velit enim., Thu Jul 24 2014 10:59:26 GMT-0700 (PDT), 568, 553, 1029, 6
767, 1102home0.jpg, 877.08, eiusmod est pariatur, Irure sint nostrud ex ipsum adipisicing incididunt consectetur cupidatat ullamco. Dolore excepteur magna exercitation dolor aute do ex., Ibiza, Officia duis elit magna in qui. Ex labore consectetur aliquip minim eiusmod elit id anim. Duis officia adipisicing tempor eu aliqua excepteur nostrud aliquip veniam. Ipsum fugiat ut adipisicing fugiat est. Esse commodo cillum ad. Enim mollit laboris consectetur anim commodo ut enim. Quis incididunt dolor do in ad., Sat Apr 28 2018 08:12:55 GMT-0700 (PDT), 5, 815, 1102, 6
768, 1065home0.jpg, 837.74, qui laborum mollit, Aute enim est irure aliqua mollit enim ad ad adipisicing. Culpa veniam et minim qui labore dolore minim., Venice, Duis nulla Lorem duis velit adipisicing quis. Irure consequat anim amet cupidatat pariatur minim fugiat. Esse minim. Excepteur minim consectetur aliquip consectetur tempor. Elit pariatur nulla nisi velit minim esse excepteur., Sun Apr 22 2018 09:41:25 GMT-0700 (PDT), 584, 328, 1065, 6
769, 1113home0.jpg, 162.00, deserunt ea tempor, Laborum id enim reprehenderit voluptate occaecat. Nisi eu dolor occaecat id reprehenderit ipsum esse., Dublin, Aliquip et aliquip qui. Ut non irure occaecat proident incididunt eu aliqua deserunt. Deserunt ea cillum., Wed Dec 06 2017 10:46:30 GMT-0800 (PST), 523, 192, 1113, 6
770, 1066home0.jpg, 780.23, excepteur ex non, Ex sunt laboris minim eu Lorem sunt. Duis reprehenderit mollit nisi laboris Lorem veniam., Berlin, Pariatur et laborum ex ut amet non sit. Aliquip elit voluptate reprehenderit amet adipisicing nostrud exercitation nulla Lorem. Nostrud voluptate. Esse est quis aliqua reprehenderit sit voluptate., Thu Sep 20 2012 19:38:28 GMT-0700 (PDT), 808, 52, 1066, 6
771, 1058home0.jpg, 908.76, aliqua eiusmod minim, Cillum sint adipisicing culpa ex officia sunt. Cupidatat enim esse eiusmod ipsum id veniam in., Mykonos, Ullamco aute minim labore consequat ex. Consectetur qui dolor non irure sit duis non sint. Velit pariatur quis enim labore ex. Incididunt aute minim. Cillum enim., Mon Sep 22 2014 13:11:57 GMT-0700 (PDT), 329, 676, 1058, 6
772, 1058home0.jpg, 469.67, occaecat officia irure, Non enim velit labore in duis. Culpa ut excepteur labore pariatur eiusmod ullamco deserunt., Barcelona, Nostrud minim. Ullamco exercitation non consequat ipsum velit. Officia veniam nulla adipisicing veniam officia cillum laboris occaecat. Pariatur laboris exercitation culpa cillum id anim non. Culpa eu ex enim exercitation eiusmod nostrud ut aute pariatur., Fri Jun 26 2015 23:36:25 GMT-0700 (PDT), 780, 189, 1058, 6
773, 1086home0.jpg, 803.46, tempor voluptate labore, Eu tempor et adipisicing non. Irure id et et mollit enim., Rome, Dolor elit anim ipsum culpa cillum nisi qui fugiat. Et in minim ut excepteur est ex aliqua aute. Nostrud Lorem cupidatat consequat commodo deserunt cillum ullamco ut. Cillum mollit aute eiusmod enim et culpa consectetur. Ut exercitation sit in quis officia., Mon Jan 28 2013 04:21:30 GMT-0800 (PST), 458, 655, 1086, 6
774, 1092home0.jpg, 527.57, est et qui, Enim labore aute velit labore incididunt tempor minim consectetur excepteur. Occaecat do in reprehenderit adipisicing pariatur exercitation adipisicing aute., Ibiza, Ipsum reprehenderit fugiat exercitation nisi dolor ad aliqua magna. Culpa in fugiat velit irure nostrud Lorem enim. Deserunt incididunt Lorem aliquip proident id aliquip sit. Nulla enim aliqua Lorem tempor est est nulla. Commodo culpa dolore ad amet incididunt exercitation minim. Commodo ea laborum excepteur ipsum consequat., Sun May 20 2018 08:21:18 GMT-0700 (PDT), 820, 575, 1092, 6
775, 1028home0.jpg, 679.11, excepteur est laboris, Duis voluptate exercitation do proident exercitation nulla non duis. Elit sint voluptate reprehenderit exercitation sit., Mykonos, Fugiat sunt voluptate adipisicing. Ex mollit nulla occaecat cupidatat aliqua do sit reprehenderit deserunt. Duis nulla cupidatat labore., Tue Oct 03 2017 05:01:05 GMT-0700 (PDT), 976, 840, 1028, 6
776, 1070home0.jpg, 577.05, nulla labore do, Id amet eu anim nostrud in cupidatat ea exercitation. Culpa commodo amet esse eiusmod sunt ad laborum ullamco., London, Ullamco magna eiusmod sint qui in. Nostrud ut. Cupidatat laboris reprehenderit ex irure est. Laborum Lorem laboris occaecat ipsum fugiat ullamco irure veniam ea. Anim dolore occaecat et adipisicing eiusmod minim tempor cillum mollit. Consequat ipsum reprehenderit., Thu Apr 14 2016 06:04:21 GMT-0700 (PDT), 307, 154, 1070, 6
777, 1033home0.jpg, 38.17, officia ullamco non, Anim veniam adipisicing sint ex amet quis ipsum. Adipisicing eiusmod adipisicing eu tempor non., Ibiza, Anim voluptate ad adipisicing est officia fugiat veniam. Mollit cillum cupidatat commodo incididunt minim non et pariatur. Duis ea dolor veniam anim. Non amet nisi excepteur aliquip sunt cupidatat adipisicing magna commodo. Est veniam elit ipsum enim ut ipsum sunt aute. Culpa dolore culpa enim dolore id eu. Eiusmod sint ad mollit id ut., Wed Sep 09 2015 02:14:49 GMT-0700 (PDT), 765, 369, 1033, 6
778, 1041home0.jpg, 546.44, officia sunt reprehenderit, Aute quis sit esse dolore. Nisi ad qui labore elit eu., Madrid, Voluptate quis adipisicing ad. Eu eiusmod officia proident. Ipsum esse culpa adipisicing et aliquip. Consectetur ad ipsum tempor adipisicing laborum proident esse commodo laboris. Ullamco non tempor et. Lorem adipisicing irure adipisicing duis. Excepteur labore eu magna deserunt., Thu May 11 2017 00:58:48 GMT-0700 (PDT), 804, 744, 1041, 6
779, 1017home0.jpg, 845.78, aliqua velit quis, Dolore sint ad voluptate ut aute officia. Voluptate voluptate occaecat pariatur ipsum., Santorini, Cillum sunt. Et eu non ea excepteur esse amet. Et tempor dolor do consectetur consequat officia incididunt., Sat Oct 21 2017 22:28:23 GMT-0700 (PDT), 84, 522, 1017, 6
780, 1076home0.jpg, 721.24, veniam duis commodo, Reprehenderit aliquip non commodo non. Elit commodo anim enim officia., Venice, Ut veniam. Eu occaecat elit. Nisi officia excepteur aliquip adipisicing eiusmod mollit commodo. Aliqua magna irure. Nisi et. Commodo labore deserunt fugiat anim fugiat incididunt aliquip., Sat Jun 03 2017 21:30:00 GMT-0700 (PDT), 931, 962, 1076, 6
781, 1049home0.jpg, 909.26, labore aliquip labore, Adipisicing proident magna proident voluptate. Esse magna consectetur proident cillum anim voluptate proident., Rome, Minim incididunt labore nulla et laboris ea. Culpa adipisicing ullamco id non minim. Cillum consequat dolor labore et mollit irure mollit., Sat Sep 21 2013 12:05:10 GMT-0700 (PDT), 108, 656, 1049, 6
782, 1029home0.jpg, 876.45, culpa id laborum, Minim tempor Lorem voluptate amet cupidatat aliqua veniam aliquip. Deserunt dolor aliqua aute irure enim minim pariatur., Madrid, Ea occaecat aliqua nulla proident aliqua quis. Anim tempor labore. Est mollit commodo labore fugiat tempor esse dolor ex enim. Reprehenderit consectetur amet velit fugiat exercitation veniam sunt ad exercitation. Pariatur culpa aute., Mon Oct 06 2014 11:09:20 GMT-0700 (PDT), 441, 929, 1029, 6
783, 1078home0.jpg, 277.40, excepteur aute aliqua, Exercitation ex in enim voluptate duis. Id adipisicing amet esse deserunt., Ibiza, Cupidatat labore ullamco ut deserunt sint elit pariatur. Aute ad deserunt est eiusmod cillum. Veniam Lorem elit incididunt ut sint., Tue Feb 14 2017 17:52:44 GMT-0800 (PST), 495, 209, 1078, 6
784, 1035home0.jpg, 174.54, sunt cupidatat qui, Lorem adipisicing pariatur consequat qui esse non dolore pariatur. Dolore elit laboris sit cupidatat deserunt ex., Cadiz, Duis aliqua. Sit sit mollit minim enim mollit consectetur deserunt velit sint. Ea excepteur veniam. Esse adipisicing quis mollit anim laboris cupidatat nulla tempor aute. Consequat id velit cupidatat. Voluptate excepteur tempor occaecat nulla ullamco., Sat Dec 12 2015 23:02:28 GMT-0800 (PST), 980, 502, 1035, 6
785, 1050home0.jpg, 487.46, ut nulla ullamco, Quis id commodo culpa cupidatat aute. Excepteur aute velit eiusmod anim do nulla aute tempor cupidatat., Ibiza, Commodo ipsum ex Lorem amet irure adipisicing amet. Mollit aliqua laborum ex nulla magna excepteur. Voluptate consectetur dolore consequat ea proident est proident labore., Tue Apr 03 2018 16:02:34 GMT-0700 (PDT), 711, 831, 1050, 6
