486, 1124home0.jpg, 574.86, aliquip ea veniam, Incididunt eiusmod consectetur incididunt tempor eu laboris elit incididunt excepteur. Velit fugiat enim proident elit qui labore proident qui irure., Mykonos, Irure eiusmod cupidatat veniam ex. Fugiat id duis irure sunt quis mollit. Reprehenderit eu minim elit aute ex elit., Sat Jul 25 2015 04:06:14 GMT-0700 (PDT), 383, 486, 1124, 6
487, 1004home0.jpg, 401.15, laborum et aliqua, Consequat amet aliqua in eu ad pariatur esse. Officia mollit consectetur ex fugiat., Paris, Laboris consequat. Ullamco nostrud aliqua magna nisi in elit ipsum amet veniam. Consectetur laborum exercitation occaecat veniam elit eiusmod eiusmod quis ex. Est et quis anim officia. Velit non Lorem velit ad ad., Tue Apr 12 2016 08:41:03 GMT-0700 (PDT), 259, 378, 1004, 6
488, 1038home0.jpg, 339.50, incididunt proident ut, Ex aliqua nostrud nostrud sit in commodo commodo sit. Pariatur cupidatat officia adipisicing esse ea elit cupidatat mollit tempor., Panama, Pariatur cupidatat exercitation nisi ad Lorem adipisicing. Eu ad duis. Consequat excepteur sit exercitation nostrud consequat proident. Adipisicing cupidatat occaecat. Do non mollit est nulla ut nostrud duis. Ex sunt excepteur in magna. Voluptate enim dolor occaecat aliquip minim do., Sat Jan 06 2018 05:26:07 GMT-0800 (PST), 665, 420, 1038, 6
489, 1021home0.jpg, 968.21, veniam aute velit, Aliqua cillum irure irure esse incididunt eu. Eu proident adipisicing consectetur aliqua ipsum anim., Rome, Ut consectetur exercitation et amet adipisicing qui mollit mollit occaecat. Aliquip cillum laboris deserunt eu dolore proident nulla. Anim sint duis exercitation eiusmod deserunt consequat Lorem aliquip. Consectetur proident cillum nulla. Laboris id ullamco tempor ad. Laboris tempor mollit., Thu Jul 27 2017 06:57:42 GMT-0700 (PDT), 836, 198, 1021, 6
490, 1048home0.jpg, 829.65, pariatur sit consectetur, Ullamco proident occaecat sit irure deserunt deserunt aute commodo aliqua. Occaecat voluptate nostrud ea ullamco sint excepteur., Ibiza, Mollit cupidatat ipsum consequat consectetur sint voluptate consequat. Ut irure consequat. Ex qui exercitation incididunt eu minim deserunt nulla., Fri Dec 01 2017 13:54:30 GMT-0800 (PST), 315, 334, 1048, 6
491, 1116home0.jpg, 343.16, esse magna quis, Anim consectetur adipisicing velit aliqua mollit reprehenderit aliquip do. Irure ea tempor occaecat aliquip aliqua incididunt aute., Paris, Aute ullamco minim consequat do. Consectetur incididunt qui et magna exercitation deserunt labore. Et mollit consectetur anim mollit enim. Qui aute nisi nisi qui. Ea duis anim. Lorem ullamco aute tempor aliqua ad ea. Velit occaecat id., Mon Mar 21 2016 04:51:28 GMT-0700 (PDT), 708, 26, 1116, 6
492, 1007home0.jpg, 454.79, cillum duis Lorem, Laboris irure do elit Lorem eu ex. Occaecat commodo esse elit officia nulla mollit enim., Venice, Esse culpa sit aute dolor sit dolore aute ut dolore. Ad dolor nisi aliqua ullamco. Consequat proident reprehenderit. Dolore ullamco eiusmod ea nostrud eiusmod reprehenderit adipisicing. Laborum esse sint ea dolor consequat ex. Qui occaecat ex esse cupidatat aute id consequat. Pariatur enim nisi excepteur consequat aliquip tempor laboris adipisicing mollit., Sat Nov 28 2015 16:33:05 GMT-0800 (PST), 80, 159, 1007, 5
493, 1023home0.jpg, 495.44, cillum commodo in, Duis est dolore eiusmod non aliquip anim. Laborum anim consectetur nisi id., Rome, Ut proident voluptate Lorem velit enim non incididunt consectetur quis. Ad Lorem consectetur sit aliquip aliquip incididunt esse ex. Ullamco pariatur ipsum voluptate eu nostrud cupidatat. Commodo ad duis mollit est nisi voluptate laboris ipsum., Mon Apr 10 2017 17:34:51 GMT-0700 (PDT), 770, 710, 1023, 6
494, 1107home0.jpg, 542.92, pariatur labore voluptate, Aute in amet magna sit proident cupidatat laborum. Esse sunt magna eu ullamco ipsum in., Berlin, Minim irure reprehenderit commodo Lorem. Qui excepteur. Cupidatat ut aute laborum. Eu non., Thu Sep 15 2016 21:32:19 GMT-0700 (PDT), 338, 410, 1107, 6
495, 1061home0.jpg, 626.35, adipisicing ea aliqua, Cillum do id consectetur sit occaecat aute occaecat. Aute sunt elit ex ea aute qui., Paris, Magna velit magna ipsum enim labore. Proident anim ullamco consectetur ex. Ad laborum est commodo consequat reprehenderit consequat id et. Aliquip consequat., Tue Jul 17 2012 01:30:04 GMT-0700 (PDT), 236, 188, 1061, 6
496, 1008home0.jpg, 190.49, aliquip incididunt ipsum, Duis nisi cupidatat ullamco ad ea. Laborum sunt anim officia culpa., Madrid, Laboris incididunt pariatur dolore exercitation est velit ea sint ut. Dolor mollit incididunt nostrud proident dolore in non cupidatat anim. Sunt commodo quis. Commodo officia magna ex non fugiat ea dolor. Esse commodo., Mon Jan 19 2015 03:26:26 GMT-0800 (PST), 230, 701, 1008, 6
497, 1108home0.jpg, 247.98, id sunt non, Exercitation aliqua sint exercitation labore quis amet irure. Ea aliqua magna adipisicing aute do do Lorem adipisicing., Cadiz, Qui proident excepteur. Enim ex. Dolor laborum nisi in in amet nulla irure aute nisi. Dolor veniam laborum anim exercitation nulla adipisicing amet. Occaecat sint. Magna non do cillum ullamco., Tue Aug 29 2017 14:51:11 GMT-0700 (PDT), 105, 321, 1108, 6
498, 1020home0.jpg, 408.99, anim proident anim, Irure ea non fugiat ipsum cupidatat ullamco irure esse. Dolore est culpa nulla sunt fugiat proident labore., Paris, Adipisicing laborum. Duis incididunt fugiat Lorem ea irure consequat. Eu enim laborum ullamco qui. In tempor cupidatat qui in ut ad., Mon May 21 2018 05:50:59 GMT-0700 (PDT), 300, 680, 1020, 6
499, 1065home0.jpg, 491.74, adipisicing officia nulla, Tempor magna reprehenderit ad id nostrud anim exercitation. Nisi duis et Lorem sit., Paris, Velit esse dolor. Deserunt sit reprehenderit nisi. Laborum anim non esse ipsum., Wed Jul 12 2017 06:56:19 GMT-0700 (PDT), 930, 863, 1065, 6
500, 1096home0.jpg, 877.93, laborum magna aliquip, Fugiat occaecat enim deserunt culpa velit. Cillum sint sunt magna ex., Panama, Reprehenderit nisi ad nulla amet amet. Enim aute excepteur consequat ex. Elit voluptate ipsum enim. Sint aute magna ad ut proident est laborum. Aliquip fugiat nostrud amet nulla et dolor sit. Labore pariatur et dolor irure., Sun Mar 26 2017 01:38:11 GMT-0700 (PDT), 390, 131, 1096, 6
501, 1061home0.jpg, 244.56, eu fugiat ex, Aute culpa aliqua consectetur qui nisi reprehenderit. Ex irure dolore laboris voluptate sint., London, Anim do eu aliquip sint ullamco esse sunt commodo. Mollit laboris fugiat in anim ex. Aliquip commodo pariatur pariatur. Dolor aute consectetur ullamco aliqua commodo. Dolor adipisicing exercitation adipisicing qui tempor ipsum. Eiusmod laborum exercitation exercitation ipsum proident ullamco. Officia aute pariatur aute commodo et velit pariatur est., Wed Jan 25 2012 15:39:38 GMT-0800 (PST), 114, 285, 1061, 6
502, 1023home0.jpg, 921.33, elit laboris officia, Incididunt reprehenderit ad excepteur amet eu mollit. Enim eu commodo fugiat non., Venice, Officia nisi mollit. Enim fugiat ex ex eu velit deserunt do sunt. Labore mollit irure aute veniam minim commodo., Mon Dec 21 2015 15:32:30 GMT-0800 (PST), 546, 737, 1023, 6
503, 1086home0.jpg, 959.36, officia aliqua laboris, Dolore eu aliqua ex non. Magna fugiat id culpa pariatur aliquip., Santorini, Laboris culpa irure nisi. Fugiat tempor nisi cillum sunt. Lorem adipisicing officia sunt commodo. Est sit incididunt aliqua tempor eiusmod aliqua magna labore. Nostrud excepteur incididunt sint laboris enim ipsum aute. Eu deserunt ullamco ut laborum., Sun Feb 10 2013 21:01:40 GMT-0800 (PST), 675, 78, 1086, 6
504, 1003home0.jpg, 470.50, pariatur est do, Enim veniam labore Lorem magna. Tempor adipisicing eiusmod est sunt ipsum aliqua dolor ullamco., Ibiza, Nulla id veniam id tempor amet ut in exercitation commodo. Reprehenderit ullamco aute id duis amet laboris aliqua. Consectetur ea id eu. Deserunt fugiat. Ad officia reprehenderit qui minim commodo cupidatat. Excepteur sint. Non velit exercitation sunt fugiat est cupidatat eu id., Wed May 01 2013 04:01:47 GMT-0700 (PDT), 204, 983, 1003, 6
505, 1010home0.jpg, 220.64, fugiat adipisicing et, Aute aliquip ea ex occaecat cillum. Ad esse eu qui eiusmod velit., Venice, Est consectetur tempor velit reprehenderit sunt sunt aliqua reprehenderit. Sint aliqua ea tempor reprehenderit fugiat nisi. Elit excepteur ex. Ex excepteur pariatur. Cillum dolore ut consequat sunt excepteur aliqua sint. Irure incididunt occaecat dolore., Sun Feb 07 2016 22:54:52 GMT-0800 (PST), 545, 101, 1010, 6
506, 1053home0.jpg, 990.42, fugiat voluptate ullamco, Velit ea veniam officia pariatur. Duis tempor velit sint excepteur magna., Santorini, Nulla cillum. Nisi est. Culpa ipsum labore minim anim consequat esse proident. Duis laborum sint est fugiat dolore elit est. Incididunt incididunt occaecat cillum. Occaecat ad laboris irure quis aute mollit sunt. Irure incididunt velit eiusmod magna laborum non., Thu Sep 03 2015 00:09:03 GMT-0700 (PDT), 67, 769, 1053, 6
507, 1006home0.jpg, 538.51, deserunt amet laborum, Fugiat ullamco nostrud anim consequat officia reprehenderit mollit ullamco commodo. Aliqua aliqua cupidatat cillum fugiat irure., Rome, Ut elit occaecat. Ex laborum est. Enim quis in., Tue Jun 20 2017 19:23:16 GMT-0700 (PDT), 873, 89, 1006, 6
508, 1097home0.jpg, 40.20, laboris dolor irure, Duis dolore id ipsum aute minim in veniam sit et. Culpa sunt aliqua aute aliqua tempor., Mykonos, Exercitation ex amet. Veniam nostrud labore elit voluptate dolore velit id. Irure laboris id officia magna nisi nostrud officia id sunt., Fri May 16 2014 00:22:15 GMT-0700 (PDT), 12, 838, 1097, 6
509, 1103home0.jpg, 215.80, eiusmod aute culpa, Quis est irure dolor sint culpa ad et aliqua nostrud. Amet aliquip exercitation sint elit excepteur consectetur qui amet., Dublin, Id sunt nisi est sit quis. Ex cillum exercitation ut ipsum fugiat cupidatat dolor labore elit. Anim ut commodo labore magna aliquip. Esse adipisicing exercitation est cillum incididunt eiusmod incididunt. Labore amet veniam mollit reprehenderit proident adipisicing. Aliquip voluptate ea proident Lorem., Mon Jun 01 2015 08:21:56 GMT-0700 (PDT), 562, 235, 1103, 6
510, 1035home0.jpg, 912.90, sint officia pariatur, Laboris proident ex exercitation amet eiusmod nostrud incididunt deserunt. Lorem anim irure non consectetur cupidatat., Barcelona, Eiusmod tempor sint. Adipisicing nulla irure fugiat eiusmod ipsum est dolor culpa. Excepteur fugiat voluptate ex commodo adipisicing ad. Excepteur adipisicing., Sun Jan 07 2018 09:40:16 GMT-0800 (PST), 720, 431, 1035, 6
511, 1063home0.jpg, 884.93, culpa cillum ut, Deserunt ut irure fugiat elit ipsum ipsum. Nostrud occaecat nisi irure exercitation eiusmod reprehenderit amet., Rome, Occaecat reprehenderit quis officia dolore deserunt cillum laborum aliquip. Aliqua est id esse sint adipisicing exercitation nisi Lorem. Veniam ut mollit quis veniam. Non do Lorem enim do eiusmod. Cupidatat irure cillum nostrud., Thu Aug 16 2012 05:12:21 GMT-0700 (PDT), 540, 559, 1063, 6
512, 1048home0.jpg, 554.09, eu quis consequat, Laboris irure excepteur in ad nostrud veniam voluptate. Dolore veniam aliqua anim dolore excepteur., Barcelona, In amet ea. Consectetur non aliqua est labore dolor elit magna reprehenderit anim. Exercitation eiusmod duis duis in cillum ad pariatur eiusmod. Eu tempor exercitation dolor ea nisi eu nostrud velit commodo. Consequat reprehenderit id laboris dolor dolore esse dolore eu incididunt. Quis culpa consequat eiusmod sint dolor id anim consectetur sunt. Excepteur aliquip veniam sit mollit adipisicing dolore., Fri Mar 08 2013 16:58:57 GMT-0800 (PST), 575, 38, 1048, 6
513, 1058home0.jpg, 498.65, laborum deserunt et, Culpa eiusmod excepteur fugiat veniam. Ullamco labore ullamco est sunt deserunt fugiat ipsum enim ullamco., Mykonos, Laborum minim incididunt. Sunt excepteur labore ipsum labore qui aliqua veniam irure. Aute ex proident officia exercitation sint sint elit. Nostrud minim et aliquip eu., Mon May 07 2018 02:10:41 GMT-0700 (PDT), 989, 812, 1058, 6
514, 1002home0.jpg, 32.80, id minim amet, Est sint cupidatat tempor laboris elit aute consectetur aliqua enim. Ut ex est dolore et nostrud nulla., Panama, Voluptate reprehenderit cillum deserunt ipsum. Laborum id sint tempor irure reprehenderit nostrud. In id nostrud ullamco occaecat., Fri May 02 2014 23:18:19 GMT-0700 (PDT), 277, 40, 1002, 6
515, 1088home0.jpg, 823.83, in et in, Nisi occaecat voluptate non duis est id pariatur aliquip nulla. Eu sint cillum officia sint veniam adipisicing pariatur., London, Enim minim ea eiusmod veniam nostrud qui est. Nisi tempor consectetur duis qui adipisicing cillum sit Lorem culpa. Aliqua eu deserunt consectetur anim duis laboris aliqua., Tue Feb 04 2014 14:27:28 GMT-0800 (PST), 716, 789, 1088, 6
516, 1071home0.jpg, 157.02, aliqua cupidatat tempor, In exercitation enim laboris consequat sunt enim id excepteur. Aute ea sint velit ipsum irure deserunt pariatur ullamco., Madrid, Sint anim ad dolor aliqua laborum aliquip cupidatat veniam. Consectetur cupidatat quis enim culpa magna Lorem do. Anim quis ad ex incididunt magna deserunt ipsum deserunt. Fugiat est., Wed Nov 27 2013 07:46:49 GMT-0800 (PST), 393, 783, 1071, 6
517, 1063home0.jpg, 797.38, consectetur sit do, Sunt eu officia minim adipisicing dolore. Eiusmod qui amet adipisicing officia cupidatat in., Ibiza, Id eiusmod nostrud et minim cupidatat id nisi. Pariatur ipsum aliquip incididunt irure. Anim aute duis aliqua minim id magna in minim cupidatat. Deserunt enim et est ullamco., Sat Oct 01 2016 21:40:23 GMT-0700 (PDT), 677, 891, 1063, 6
518, 1060home0.jpg, 361.33, elit proident commodo, Nostrud enim est proident esse qui aute. Veniam ad proident qui excepteur fugiat., Paris, Lorem culpa et ad. Cillum sint voluptate. Labore reprehenderit laboris adipisicing Lorem fugiat. Occaecat consequat elit nostrud., Tue Mar 27 2012 19:56:18 GMT-0700 (PDT), 863, 114, 1060, 6
519, 1029home0.jpg, 340.77, anim ullamco fugiat, Ad consectetur laborum duis qui ut. Cillum exercitation exercitation dolore dolor occaecat ullamco ex quis., Venice, Do laborum laborum. In labore. Culpa ea deserunt est nostrud aliqua excepteur laboris incididunt. Cillum velit. Cupidatat irure cupidatat dolore ullamco elit. Commodo qui incididunt incididunt. Cupidatat cupidatat sit tempor quis., Sat Apr 04 2015 13:55:27 GMT-0700 (PDT), 961, 392, 1029, 6
520, 1078home0.jpg, 335.34, et sunt sint, Mollit dolor Lorem reprehenderit sint enim non nisi aliqua ullamco. Veniam duis aute consequat non esse adipisicing exercitation do ullamco., Rome, Officia consequat consequat sint dolore pariatur do. Est eu laboris aliqua laboris reprehenderit reprehenderit magna. Sint labore aliqua reprehenderit mollit laboris aute officia anim anim. Id officia consequat ullamco do nisi quis. Mollit amet eiusmod fugiat cillum et. Mollit laboris cupidatat elit dolore irure. Amet amet irure eiusmod aliqua reprehenderit., Mon Jul 03 2017 20:51:06 GMT-0700 (PDT), 732, 655, 1078, 6
521, 1082home0.jpg, 468.68, sit consectetur ea, Voluptate dolor excepteur incididunt esse in officia labore eu. Dolore dolor ad pariatur duis., Ibiza, Commodo velit culpa aute eu pariatur ea mollit aliqua. Pariatur dolore sit elit voluptate do dolor ad commodo. Enim veniam incididunt proident mollit anim. Exercitation proident mollit voluptate. Veniam culpa voluptate ullamco. Ipsum irure incididunt quis non veniam adipisicing qui amet laborum. Non irure sit proident eiusmod sint amet ad consequat labore., Thu Mar 29 2018 19:01:26 GMT-0700 (PDT), 359, 50, 1082, 6
522, 1040home0.jpg, 790.77, incididunt incididunt officia, Cillum incididunt est duis incididunt deserunt excepteur ipsum. Tempor pariatur nostrud labore magna ipsum adipisicing magna nostrud., Dublin, Adipisicing aliquip. Aliqua consectetur labore anim cupidatat officia quis anim velit. Incididunt aliqua minim voluptate exercitation aute pariatur occaecat et adipisicing. Sit irure in est ullamco cillum reprehenderit proident aute. Excepteur exercitation proident non minim. Ipsum anim eiusmod nisi. Nulla magna., Sun Aug 17 2014 03:38:09 GMT-0700 (PDT), 213, 882, 1040, 6
523, 1075home0.jpg, 877.94, nostrud magna pariatur, Exercitation cillum magna mollit tempor nisi ut deserunt mollit. Do deserunt laboris proident sit., Paris, Duis elit et eu laborum magna do eu non in. Minim do. Ex magna enim enim ea eiusmod id. In irure laboris nulla officia do qui proident. Aute non sunt non laboris reprehenderit laboris ex anim dolor. Lorem aliqua ullamco proident consectetur commodo., Wed Jan 07 2015 23:41:20 GMT-0800 (PST), 20, 264, 1075, 6
524, 1108home0.jpg, 809.75, pariatur minim nisi, Sunt proident ipsum pariatur ea proident. Sunt veniam dolor velit cillum quis magna ipsum ipsum., Madrid, Ad aliquip do nostrud. Velit deserunt do sunt. Pariatur dolore ipsum duis commodo dolore incididunt minim est. Eu tempor ut tempor tempor. Reprehenderit sint. Esse laborum exercitation laborum proident., Thu Aug 25 2016 10:18:03 GMT-0700 (PDT), 269, 563, 1108, 6
525, 1011home0.jpg, 19.83, aliqua laborum Lorem, Aute occaecat voluptate ex tempor tempor ex ipsum nisi nostrud. Excepteur amet sit culpa laborum Lorem., Madrid, Ad excepteur aliquip aliqua. Culpa dolor aliquip cillum. Id ut sunt cupidatat non exercitation. Id ut quis culpa consequat. Enim officia Lorem velit excepteur. Non mollit ex., Wed Aug 24 2016 07:32:41 GMT-0700 (PDT), 209, 688, 1011, 6
526, 1086home0.jpg, 656.20, aute enim consequat, Irure magna aliqua ullamco laboris ullamco dolore. Voluptate veniam id proident magna sit., Ibiza, Labore officia nisi ad minim velit occaecat velit. Occaecat sunt eu minim do minim proident. Amet duis ea exercitation consectetur cupidatat. Anim reprehenderit., Sat Nov 22 2014 06:20:57 GMT-0800 (PST), 588, 207, 1086, 6
527, 1090home0.jpg, 301.11, duis officia eiusmod, Do excepteur do consequat consequat velit officia. Ea officia minim exercitation incididunt ut duis laborum., Berlin, Aliquip Lorem pariatur aliqua nulla ad aliqua ex excepteur sint. Qui consequat officia minim quis sunt. Non cupidatat cupidatat. Mollit sit labore quis anim in sint elit., Thu Aug 16 2012 06:36:10 GMT-0700 (PDT), 47, 397, 1090, 6
528, 1112home0.jpg, 459.89, et ut laboris, Et minim aliqua irure mollit sit labore do. Proident laboris dolore cillum eiusmod., Barcelona, Exercitation velit nostrud elit velit dolore. Irure est elit. Quis ad incididunt. Reprehenderit fugiat eiusmod minim ex. Labore dolor minim pariatur. Velit occaecat adipisicing laboris consequat sint., Sun Dec 31 2017 10:33:55 GMT-0800 (PST), 25, 515, 1112, 6
529, 1035home0.jpg, 424.21, aliquip magna quis, Anim tempor voluptate irure ad. Amet adipisicing sit ullamco eu pariatur officia sunt cupidatat est., Paris, Nulla sunt enim pariatur sunt elit sunt. Exercitation est magna velit voluptate qui velit duis quis ad. Esse reprehenderit sunt esse nulla in sint Lorem., Mon Mar 05 2018 08:13:19 GMT-0800 (PST), 98, 189, 1035, 6
530, 1089home0.jpg, 278.77, nisi sunt occaecat, Do consequat ut irure aliquip mollit voluptate non. Ea sunt mollit aliqua veniam proident tempor sint., Berlin, Amet in voluptate est. In ad id quis veniam laborum proident. Consequat enim aliqua aliqua voluptate ea labore esse officia. Tempor ullamco ullamco. Elit sit. Cillum laboris aute aute., Thu May 19 2016 09:53:08 GMT-0700 (PDT), 106, 528, 1089, 6
531, 1023home0.jpg, 538.86, aliquip quis sint, Deserunt ut ut proident ad. Exercitation occaecat do aliquip est amet., Madrid, Et exercitation enim qui aliqua. Incididunt voluptate laboris sit ad officia eu. Id fugiat enim enim anim. Commodo fugiat ullamco ipsum magna. Occaecat cillum Lorem ad elit cupidatat magna., Sat Mar 14 2015 21:48:21 GMT-0700 (PDT), 159, 616, 1023, 6
532, 1056home0.jpg, 709.03, pariatur id ad, Velit et officia sit reprehenderit. Sint duis ullamco minim magna., Paris, Exercitation anim Lorem magna. Do voluptate enim. Ad aute sit ad laboris. Consectetur incididunt exercitation mollit. Eu ipsum., Tue Mar 20 2018 18:18:42 GMT-0700 (PDT), 138, 240, 1056, 6
533, 1121home0.jpg, 63.83, minim nisi veniam, Id minim mollit aliquip occaecat. Anim velit sunt ipsum sint voluptate ut cillum., Cadiz, Minim aute excepteur ex culpa veniam anim enim labore. Non dolor. Nostrud excepteur incididunt sunt., Thu Dec 08 2016 01:35:01 GMT-0800 (PST), 862, 87, 1121, 6
534, 1011home0.jpg, 56.11, magna incididunt dolore, Enim voluptate labore aliqua minim id. Quis ad non laboris ad eu dolor do cupidatat nulla., Mykonos, Cillum laborum veniam irure mollit quis mollit Lorem proident pariatur. Nisi mollit mollit eu quis. Aliqua pariatur adipisicing adipisicing nisi aliquip voluptate ut tempor culpa. Quis nisi id aliqua voluptate ullamco ex aliquip ex., Sun Jun 04 2017 02:08:51 GMT-0700 (PDT), 695, 226, 1011, 6
535, 1070home0.jpg, 47.00, amet exercitation irure, Officia aliqua in ut excepteur ipsum. Sunt ut qui quis laborum aliqua minim sint consequat ut., Santorini, Quis sint excepteur incididunt magna non. Aute tempor eiusmod quis id adipisicing dolor. Ipsum laborum. Ad consequat sit culpa eu magna non sunt., Mon Sep 23 2013 04:38:44 GMT-0700 (PDT), 922, 907, 1070, 6
536, 1006home0.jpg, 697.77, aliqua proident magna, Do id cillum do eiusmod id do consectetur. Ad et Lorem sunt excepteur reprehenderit in., Berlin, Adipisicing ad dolor. Dolor velit sit sint labore. Sit ad in qui Lorem pariatur cupidatat sit. Occaecat elit aute occaecat. Non eu ipsum aliqua culpa Lorem enim labore sint officia., Thu Apr 05 2018 03:37:25 GMT-0700 (PDT), 451, 956, 1006, 6
537, 1067home0.jpg, 405.09, laborum magna ut, Laborum dolore enim deserunt laborum ea duis quis dolore. Commodo qui incididunt eu do commodo aliqua et irure mollit., Dublin, Qui eiusmod consequat excepteur eiusmod sit. Ullamco dolor. Ipsum aliquip non aute ex non amet quis elit dolore. Magna nulla ipsum nostrud exercitation in sit laboris tempor minim. Est dolore sunt do veniam nulla esse reprehenderit incididunt proident. Aliqua elit eiusmod fugiat ad consequat aliqua ipsum cupidatat. Commodo duis sunt est Lorem veniam dolor officia eu sit., Mon Dec 31 2012 20:42:23 GMT-0800 (PST), 159, 793, 1067, 6
538, 1064home0.jpg, 31.33, ea dolor Lorem, Adipisicing proident nisi occaecat sunt adipisicing officia culpa non ad. Sunt officia ipsum nisi aliqua non esse magna consectetur., Madrid, Labore aliquip. Est voluptate dolor exercitation dolore ad. Pariatur irure qui velit consequat velit dolor incididunt., Thu Aug 21 2014 08:34:11 GMT-0700 (PDT), 381, 67, 1064, 6
539, 1106home0.jpg, 393.80, nulla do sunt, Id elit pariatur consequat anim duis Lorem ut nisi. Veniam voluptate nisi excepteur consectetur sint nulla eiusmod eiusmod reprehenderit., Cadiz, Magna do. Ea officia ut excepteur est laborum labore labore commodo. Commodo Lorem nisi. Dolor enim excepteur tempor nulla eu. Sint consequat. Qui occaecat exercitation., Sat Mar 28 2015 16:05:20 GMT-0700 (PDT), 983, 392, 1106, 6
540, 1042home0.jpg, 447.48, adipisicing irure dolore, Dolor proident elit commodo et nisi dolore laborum laborum. Eu reprehenderit ex officia aute sint., Berlin, Officia occaecat pariatur dolore ut adipisicing enim consequat nostrud elit. Eu adipisicing occaecat do ex. Qui aliquip eiusmod. Elit consequat nulla cupidatat laboris ex. In nulla laboris aliquip qui esse non aliqua., Wed Mar 22 2017 01:23:14 GMT-0700 (PDT), 81, 404, 1042, 6
541, 1083home0.jpg, 382.16, velit sunt amet, Nulla sint dolor aliquip commodo proident anim qui. Commodo amet deserunt id mollit deserunt qui nisi aliqua ullamco., Rome, Ut eu reprehenderit. Dolor excepteur id ad excepteur dolor tempor do. Sint incididunt aliqua culpa occaecat. Culpa incididunt id id voluptate dolore minim., Sun Oct 29 2017 01:11:58 GMT-0700 (PDT), 894, 859, 1083, 6
542, 1037home0.jpg, 236.01, minim ut aliquip, Reprehenderit aliquip culpa culpa ullamco. Ullamco eu quis eiusmod fugiat eiusmod fugiat., Berlin, Sunt reprehenderit fugiat exercitation reprehenderit et ullamco cillum. Officia reprehenderit cillum non tempor. Ad qui esse nisi et ullamco est., Wed Jan 22 2014 00:13:29 GMT-0800 (PST), 551, 320, 1037, 6
543, 1122home0.jpg, 264.97, voluptate laboris ipsum, Id sint nulla velit enim. Ea commodo aute minim tempor amet ad velit consequat., Rome, Officia fugiat dolore minim non duis id. Lorem magna Lorem magna esse nulla excepteur deserunt. Aliquip nulla excepteur amet reprehenderit et eiusmod labore aute. Sunt dolore. Ut non dolore amet est culpa fugiat sunt incididunt., Wed Dec 07 2016 11:12:29 GMT-0800 (PST), 129, 808, 1122, 6
544, 1056home0.jpg, 771.17, laborum commodo ullamco, Aliquip et eu dolore amet esse culpa ullamco non. Laborum ad reprehenderit adipisicing in incididunt incididunt., Rome, Sint minim reprehenderit laborum eiusmod ea. Dolore eu enim enim tempor. Ex ipsum fugiat consectetur sint sint culpa. Laboris commodo ea labore ex cillum laborum adipisicing culpa. Est occaecat elit incididunt sunt cillum velit anim sint ipsum. Commodo adipisicing mollit., Fri Jun 06 2014 17:14:51 GMT-0700 (PDT), 570, 692, 1056, 6
545, 1100home0.jpg, 910.36, exercitation labore nulla, Occaecat ipsum sunt aliqua tempor mollit ullamco exercitation quis elit. Fugiat commodo cupidatat est voluptate., Barcelona, Fugiat nulla do. Labore irure. Exercitation in reprehenderit laborum voluptate amet anim. Sit ut proident duis amet cupidatat mollit dolor. Sit non aliquip tempor in culpa., Thu Dec 08 2016 02:03:51 GMT-0800 (PST), 976, 374, 1100, 6
